Headlines,Dates,Descriptions
Elon Musk Says Tesla Is Making a Mini-Car That Can Fit an Adult,6 Aug 2018,"Tesla CEO Elon Musk said on Sunday that the company is making a ""mini-car"" that can fit an adult. Musk did not provide further details about Tesla's..."
The all-electric Mercedes EQ C is ready to fight Tesla,4 Sept 2018,"The EQ C's front electric motor aims to offer the most efficiency, while the rear motor – this is a four-wheel-drive vehicle, like the Jaguar I-Pace and Tesla..."
Elon Musk shows a kinder side as he announces Tesla losses,1 Aug 2018,"Tesla CEO Elon Musk apologized for ""bad manners"" on a previous earnings call, then announced bigger losses for his company."
A Question for Tesla's Board: What Was Elon Musk's Mental State? (Published 2018),15 Aug 2018,"The explanation for the tweet may be more psychological than strategic. In a Twitter exchange from last summer, Mr. Musk said he experienced “great highs,..."
Tesla's Turbulent Week at the Stock Exchange,16 Aug 2018,"This chart shows the share price for Tesla from July 16th to August 15th, 2018 in US dollars."
Utah driver sues Tesla after crashing in Autopilot mode,5 Sept 2018,A Utah driver who slammed her Tesla into a stopped firetruck at a red light earlier this year while using the vehicle's semi-autonomous function has sued...
"Tesla Model 3, Model S Fail Automatic Braking System Stress Test: IIHS",7 Aug 2018,"Five car models from Tesla, BMW, Mercedes, and Volvo were required to drive toward a stationary item with adaptive cruise control turned off and only the..."
"Mercedes to overtake Tesla as electric vehicle market leader, says PA Consulting",11 Jul 2018,"Tesla is predicted to sell the most electric cars in 2019, but by 2021 PA Consulting says that Mercedes will become the market leader in EV production."
Tesla’s new bug bounty protects hackers — and your warranty,6 Sept 2018,"Good news if you're into hacking your car, you probably won't void your warranty. The electric car giant confirmed the move in a tweet this week. Tesla's."
Tesla stock plummets after Elon Musk smokes weed on live show and two execs quit in one day,7 Sept 2018,"Tesla stock plummets after Elon Musk smokes weed on live show and two execs quit in one day. A total of 48 executives have reportedly left Tesla this year, and..."
Tesla curbs paint choices to simplify production,11 Sept 2018,"Moving 2 of 7 Tesla colors off menu on Wednesday to simplify manufacturing. Obsidian Black & Metallic Silver will still be available as special request, but at..."
Tesla's head of HR has resigned,7 Sept 2018,"Gabrielle Toledano, Tesla's head of human resources, has resigned, Bloomberg first reported. Toledano confirmed her departure in an email to Business..."
Tesla’s new bug bounty protects hackers — and your warranty,6 Sept 2018,"Good news if you're into hacking your car, you probably won't void your warranty. The electric car giant confirmed the move in a tweet this week. Tesla's."
Elon Musk Says Tesla Is Making a Mini-Car That Can Fit an Adult,6 Aug 2018,"Tesla CEO Elon Musk said on Sunday that the company is making a ""mini-car"" that can fit an adult. Musk did not provide further details about Tesla's..."
The all-electric Mercedes EQ C is ready to fight Tesla,4 Sept 2018,"The EQ C's front electric motor aims to offer the most efficiency, while the rear motor – this is a four-wheel-drive vehicle, like the Jaguar I-Pace and Tesla..."
Elon Musk shows a kinder side as he announces Tesla losses,1 Aug 2018,"Tesla CEO Elon Musk apologized for ""bad manners"" on a previous earnings call, then announced bigger losses for his company."
A Question for Tesla's Board: What Was Elon Musk's Mental State? (Published 2018),15 Aug 2018,"The explanation for the tweet may be more psychological than strategic. In a Twitter exchange from last summer, Mr. Musk said he experienced “great highs,..."
Utah driver sues Tesla after crashing in Autopilot mode,5 Sept 2018,A Utah driver who slammed her Tesla into a stopped firetruck at a red light earlier this year while using the vehicle's semi-autonomous function has sued...
Elon Musk Says Saudi Investment Fund Could Help Him Take Tesla Private,13 Aug 2018,"The Tesla CEO, reportedly under scrutiny by federal regulators for earlier statements, says the Saudi fund is looking to diversify away from oil with a..."
"Mercedes to overtake Tesla as electric vehicle market leader, says PA Consulting",11 Jul 2018,"Tesla is predicted to sell the most electric cars in 2019, but by 2021 PA Consulting says that Mercedes will become the market leader in EV production."
Tesla stock plummets after Elon Musk smokes weed on live show and two execs quit in one day,7 Sept 2018,"Tesla stock plummets after Elon Musk smokes weed on live show and two execs quit in one day. A total of 48 executives have reportedly left Tesla this year, and..."
Tesla Faces Giant 17% Stock Swings Ahead,18 Jul 2018,Wild Ride. The long straddle options strategy for expiration on September 18 suggest that the stock may rise or fall by roughly 17% from the $320 strike price.
Tesla curbs paint choices to simplify production,11 Sept 2018,"Moving 2 of 7 Tesla colors off menu on Wednesday to simplify manufacturing. Obsidian Black & Metallic Silver will still be available as special request, but at..."
Audi e-tron takes on Tesla Model X as electric cars war heat up,18 Sept 2018,"It features a traditional shape that recalls its gas-powered counterparts in the Audi family, and is almost as big as the upmarket Q8 SUV. E-tron offers seating..."
Tesla Model 3 Has Highest Profit Margin of Any Electric Vehicle,19 Jul 2018,"Munro & Associates said the build quality was like a Kia from the 90s. Now, the company has completed its analysis. While Munro's opinion on the fit and..."
"42 Tesla Employees Describe Intense Conditions, Life Under Elon Musk",4 Sept 2018,70-hour weeks and 'WTF' emails: 42 employees reveal the frenzy of working at Tesla under the 'cult' of Elon Musk · Monthly. $1 first month. Plus taxes. Renews...
"Tesla to sustain Model 3 “burst” production rate in July, suggests online tracker",9 Jul 2018,"Tesla had to implement a number of unorthodox strategies to achieve the production milestone, including building an entirely new general assembly line inside a..."
"Tesla Shares Slide After More Executives Leave, Musk Interview",7 Sept 2018,share price sank to near its lowest point for the year Friday after the electric-car maker lost more executives and Chief Executive Elon Musk appeared to smoke...
The Tesla Model 3 Makes Me Wonder About the Future,29 Jul 2018,"Perhaps this is the thing with the Model 3. Even with issues of quality and company, the car is enough of a solved question to make you look at the calendar."
New NVIDIA Data Center Inference Platform to Fuel Next Wave of AI-Powered Services,12 Sept 2018,"GTC Japan -- Fueling the growth of AI services worldwide, NVIDIA today launched an AI data center platform that delivers the industry's most advanced..."
Tesla pulls 2 paint colors to 'simplify manufacturing',11 Sept 2018,"Two Tesla paint colors, Obsidian Black and Metallic Silver, won't be offered on the seven-color paint menu on new Tesla vehicles to improve manufacturing."
Polestar unveils first production EV with aim to overtake Tesla,21 Sept 2018,Polestar debuted its first production EV and previewed its electric car line in New York with the CEO squarely taking aim at Tesla.
Tesla opens Model 3 car sales to all North America customers,10 Jul 2018,Tesla is taking orders for its Model 3 electric sedans in the U.S. and Canada. Customers have to make a $2500 deposit up front.
Some Tesla Customers Experience Service Problems,22 Aug 2018,"Customers have reported problems before, during, and after receiving their vehicles, including delayed deliveries, broken door handles, and internal computer..."
Tesla Board Surprised by Elon Musk's Tweet on Taking Carmaker Private (Published 2018),13 Aug 2018,Tesla Board Surprised by Elon Musk's Tweet on Taking Carmaker Private ... An abrupt tweet last week by Elon Musk about the prospect of taking Tesla private was...
Mercedes tries to catch up to Tesla with its all-electric SUV,4 Sept 2018,"Following years of rumors that Mercedes-Benz might unleash an electric model into a high-end market that has so far been dominated by Tesla, the German auto..."
Tesla Model 3 vs. CPO Tesla Model S — Owner Perspective,5 Aug 2018,"It has more than sufficient acceleration for getting on the highway and passing. Model S handles well, but compared to Model 3, it feels a bit more “floaty,” as..."
Tesla's Board Is Conducting a Search for a New COO: Report,17 Aug 2018,"Tesla could be looking to hire another top executive to take up some of CEO Elon Musk's workload as the embattled head digs deeper, but Musk says he has no..."
Tesla finally manages to produce 5000 Model 3 cars in a week,2 Jul 2018,An internal email from Elon Musk to Tesla employees said the company is finally making 5000 Model 3 cars per week.
"Tesla starts building its own car carriers due to 'extreme shortage' in Model 3 delivery rush week, says Elon Musk",24 Sept 2018,"Tesla is bringing those truckloads to delivery centers, but it is also delivering them directly to customers at their homes or offices. It's not the only..."
"Tesloop Shares Lessons Learned In 400,000 Miles In A Tesla",9 Jul 2018,"Shuttle service Tesloop has hit an astonishing 400000 miles in one of its Model S vehicles, making it the Tesla with the highest reported mileage in the..."
A Tesla Is Not Just a Car for Elon Musk's Superfans,20 Jul 2018,"With the cancellation of the credit, Dr. Markus Giesler, a consumer sociologist at York University in Toronto, says wannabe Tesla owners are “existentially..."
Tesla's Model 3 Is Now America's Best-Selling Electric Car,3 Apr 2018,It's official: Tesla's new Model 3 is now the best-selling electric car in the U.S.. Tesla Inc. released its production numbers for the first quarter...
"Tesla sues former employee for allegedly stealing gigabytes of data, making false claims to media",20 Jun 2018,"Tesla sues former employee for allegedly stealing gigabytes of data, making false claims to media ... Tesla is suing a former employee for allegedly illegally..."
How Tesla Scored A Zero On Climate Management,27 Jun 2018,"Widely regarded as the most climate-conscious automaker, Tesla Motors nonetheless earned a zero score this year in an assessment of corporate climate..."
Tesla & Beyond: A Holistic Approach to Electric Vehicles & Future Mobility Ecosystem,7 Jun 2018,Each one of these vehicles will require a lithium ion battery to power it. Most EVs are utilizing new variations of lithium-ion chemistry that sacrifice energy...
Panasonic reduces Tesla’s cobalt consumption by 60% in 6 years …,3 May 2018,Tesla and Panasonic have made strong headway in reducing the cobalt reduction in its 18650 cells used in both the Model S and Model X. They have carried this...
Tesla cars selling in S'pore for S$500000,4 Jun 2018,"3. Model X 75D. Tesla's Model X Sport Utility Vehicle (SUV) has gull-wing doors. It has a range of about 380km and costs S$528,800. It surges to 100km/h in 5.2..."
My Day at Tesla: What I Learned,29 Jun 2018,"The company realizes they need a bigger focus on talent mobility and career management, and was asking lots of questions about talent reviews and succession. So..."
The economic footprint of Tesla in California,15 May 2018,"Tesla infused approximately $4.1 billion into the California economy: $2.0 billion in transactions with over 2,650 California Tier 1 suppliers (average spending..."
Elon Musk fends off challenge to Tesla control,5 Jun 2018,Elon Musk fends off challenge to Tesla control ... Elon Musk has survived a bid to strip him of a key role at Tesla as shareholders re-elected three directors to...
Tesla and China trade war: Elon Musk has tough tariff riddle to solve,4 Apr 2018,"The reports say Tesla would operate in a free-trade zone in Shanghai. This would allow Tesla to keep its intellectual property secret, but could still force it..."
A Brief History Of Tesla: $19 Billion Raised And $9 Billion Of Negative Cash Flow,25 Apr 2018,In the past three years Tesla has lost $3.0 billion and spent $6.3 billion on capital. That is not a sustainable operating business model. Not even close.
"Tesla misses Model 3 production target of 2,500 vehicles a week",3 Apr 2018,"Tesla aimed to hit a production target of 2,500 Model 3 sedans a week by the end of the first quarter and 5,000 a week by the end of the second quarter. The..."
Why Tesla Is Smart To Prioritize Premium Versions Of The Model 3,24 May 2018,"Premium vehicles typically have much thicker margins compared to mass market cars, and luxury car buyers are also more likely to take on options such as..."
Tesla will enable orders for new Model 3 versions next week,11 May 2018,"Tesla will begin taking orders for a dual motor, all-wheel drive model and a performance version of the Model 3 at the end of next week."
Tesla factory paint shop fires worse than revealed: Workers,1 Jun 2018,"Employees say Tesla has experienced at least four fires in its paint shop in the last four years, and that sprinklers and air filtration systems are clogged..."
"Tesla still isn't profitable 8 years after its IPO. But, it hasn't been alone.",29 Jun 2018,"Tesla still isn't profitable 8 years after its IPO. But, it hasn't been alone. ... Since it went public eight years ago, Tesla's share price has risen nearly..."
Tesla hires new chief financial officer for China,26 May 2018,Zhou previously served as CFO for Asia Pacific and India for Ingersoll Rand.
"Sell Tesla shares because BMW, Audi competition is coming: JP Morgan",20 Apr 2018,"Sell Tesla shares because BMW, Audi competition is coming: JP Morgan ... Tesla,. The Tesla Model 3 vehicle is displayed ahead of the Los Angeles Auto Show in Los..."
Elon Musk admits Tesla will have to turn a profit one day,12 Jun 2018,"“What drives us is our mission to accelerate the world's transition to sustainable, clean energy, but we will never achieve that mission unless we eventually..."
"Elon Musk is stressed, says he's sleeping on Tesla factory floor and has no time to go home and shower",11 Apr 2018,"Elon Musk is stressed, says he's sleeping on Tesla factory floor and has no time to go home and shower ... With Tesla's Model 3 production behind, Elon Musk is so..."
Tesla Model 3: Photos of Elon Musk’s Factory in Fremont,8 Jun 2018,"This robotic dance is a visceral representation of what Tesla chief executive Elon Musk has dubbed “Alien Dreadnought,” a code name for the factory that evokes..."
"My First 3 Years With The Tesla Model S: Epic, If Not Quite Perfect",30 May 2018,"My First 3 Years With The Tesla Model S: Epic, If Not Quite Perfect · Door Handle. Tesla door handles extend out automatically when you approach the car."
"Tesla battery production is the real bottleneck, not Model 3 production, analyst says",18 Apr 2018,"Tesla's production problem may be due to quality issues in its new battery cells, and the company may need a partner to ramp up Model 3 assembly."
Tesla factory to be investigated over safety concerns,19 Apr 2018,Tesla factory to be investigated over safety concerns ... Tesla is facing an investigation by Californian safety regulators into reports of serious injuries at...
Here are highlights of Elon Musk's strange Tesla earnings call: 'They're killing me',3 May 2018,"Here are highlights of Elon Musk's strange Tesla earnings call: 'They're killing me' · Tesla earnings call was the best I've heard in a long time, says · Musk..."
"Musk says Tesla pushed out 7,000 cars last week, meeting goal of 5,000 Model 3s",1 Jul 2018,"After repeatedly pushing back internal targets, Tesla vowed in January to build 5,000 Model 3s per week before the close of the second quarter on Saturday to..."
Elon Musk says making a cheaper Model 3 now would cause Tesla to 'die',21 May 2018,"Tesla has long promised drivers a $35000 Model 3 electric sedan. Now, CEO Elon Musk says that this standard Model 3 won't be available until 3-6 months..."
"With More Self-Driving Tech, Is Tesla Ruining What's Best About the Model S?",18 Jun 2018,"Tesla may not have intended its five-person sedan to be a car for people who love driving, but that's what it is. And now that's starting to change."
Tesla to cut 9% of jobs in 'difficult but necessary' reorganization,12 Jun 2018,"Tesla to cut 9% of jobs in 'difficult but necessary' reorganization · Tesla will cut approximately 9 percent of its 46,000-person workforce. · Cuts will focus..."
"Tesla's problem: overestimating automation, underestimating humans",2 May 2018,"This could be a problem for overly automated factories where small physical discrepancies (a broken wheel, wear and tear on the ground, imprecisely positioned..."
How Tesla Is Building Cars in Its Parking Lot,22 Jun 2018,"Though the big tent is classified under California's building code as a “repair garage,” Tesla says it's most definitely an assembly line, where the major..."
Tesla Model 3 falls short of Consumer Reports recommendation,21 May 2018,Consumer Reports said stopping distance and other flaws outweighed the Tesla Model 3 positive qualities.
Tesla on fire: UK director Michael Morris' car bursts into flames,17 Jun 2018,"Tesla on fire: UK director Michael Morris' car bursts into flames ... A Tesla car driven by British TV director Michael Morris burst into flames in Los Angeles,..."
"What is Tesla MOS, software employee allegedly hacked?",22 Jun 2018,"Rather, Tesla built its MOS software to automate factory processes for assembling the Model 3, its newest vehicle. In general, MOS is used to track where a..."
Musk Says Excessive Automation Was 'My Mistake',13 Apr 2018,"Tesla Inc.'s Elon Musk, who's built up an aura around how automated his car assembly plant will be, has good news for humans: We still need your help."
Tesla to cut 9% of jobs in restructuring,12 Jun 2018,Tesla to cut 9% of jobs in restructuring ... Simply sign up to the US & Canadian companies myFT Digest -- delivered directly to your inbox. Tesla is to cut 9 per...
Tesla posts record $710m net loss as it struggles to produce Model 3 cars,2 May 2018,Tesla posts record $710m net loss as it struggles to produce Model 3 cars ... Tesla posted a record $709.6m net loss in the first quarter and burned through...
Tesla is the biggest short in the US stock market,11 Apr 2018,Tesla is once again the largest short sell on Wall Street.
Elon Musk says Tesla planning 'thorough reorganization',15 May 2018,"Elon Musk says Tesla planning 'thorough reorganization' ... Tesla's chief executive, Elon Musk, told employees on Monday the company was undergoing a “thorough..."
"Tesla Misses Model 3 Target, But Quarterly Update Calms Investor Jitters For Now",3 Apr 2018,"The company didn't hit its 2500-unit weekly production target for the car, but got reasonably close. Tesla's announcement that it won't need to raise..."
"Tesla Doesn't Burn Fuel, It Burns Cash",30 Apr 2018,"Tesla is going through money so fast that, without additional financing, there is now a genuine risk that the 15-year-old company could run out of cash in 2018."
Tesla cuts 9 percent of workforce in search for profit,12 Jun 2018,Electric car maker Tesla Inc <TSLA.O> is cutting several thousand jobs across the company as it seeks to reduce costs and become profitable without...
Inside Tesla's Audacious Push to Reinvent the Way Cars Are Made (Published 2018),30 Jun 2018,"Inside Tesla's Audacious Push to Reinvent the Way Cars Are Made. Scrambling to turn out its first mass-market electric car, the automaker set up multiple..."
Tesla: reality begins to collide with Elon Musk's vision,15 Jun 2018,"A disarming admission about his own habitual over-optimism followed. But that did not stop him declaring, straight-faced, that Tesla was likely to hit a..."
"Can Tesla Ever Make A $35,000 Model 3?",21 May 2018,"More than two years after Tesla started taking $1,000 deposits for the Model 3, it's increasingly unclear whether it can actually afford to sell the much-touted..."
Elon Musk hits back at report that Tesla didn't want to spend on sensors,14 May 2018,"Elon Musk hits back at report that Tesla didn't want to spend on sensors · On Twitter, Elon Musk called a Wall Street Journal report “false.” · The report..."
"If you invested $1,000 in Tesla in 2010, here’s how much you’d have now",1 Jun 2018,"And if you invested in Tesla in 2010, when it made its initial public offering, that investment could have paid off, too. A $1,000 investment in the company..."
HK$2 million golf carts cost more than a Tesla in Hong Kong,24 Apr 2018,Old-fashioned golf cart is the hottest buy in one corner of Hong Kong.
Read what Elon Musk told Tesla after the car maker met its Model 3 goal,1 Jul 2018,Read what Elon Musk told Tesla after the car maker met its Model 3 goal · Tesla met a goal of rolling out 5000 Model 3 cars in a week. · CEO Elon Musk told...
How to land a job at Tesla,16 Apr 2018,"To get a job at Tesla, applicants need to demonstrate that they possess these qualities. Using examples from previous work experience, bringing a portfolio of..."
Elon Musk offers more detail about Tesla’s ridesharing network,2 May 2018,"On Tesla's Q1 2018 earnings call today, Tesla CEO Elon Musk shed some light on the company's ambitions to launch an autonomous-vehicle ridesharing."
Elon Musk drafts in humans after robots slow down Tesla Model 3 production,17 Apr 2018,Elon Musk drafts in humans after robots slow down Tesla Model 3 production ... Elon Musk has admitted that automation has been holding back Tesla's Model 3...
"Tesla, Safety Agency Feud Over Fatal-Crash Probe",12 Apr 2018,"The NTSB said Thursday that it tossed Tesla from the probe, asserting the auto maker violated a formal agreement when it released detailed information this week..."
Tesla halts Model 3 production as firm scrambles to improve automation,17 Apr 2018,Tesla halts Model 3 production as firm scrambles to improve automation ... Tesla has temporarily suspended its Model 3 assembly line as Elon Musk's electric car...
"Tesla says top vehicle engineer Doug Field is ""taking time off"" amid Model 3 production struggles",11 May 2018,"Tesla says top vehicle engineer Doug Field is “taking time off” amid Model 3 production struggles · Tesla said its senior vice president of engineering, Doug..."
Musk launches 'thorough reorganisation' of Tesla management,14 May 2018,"“As part of the reorg, we are flattening the management structure to improve communication, combining functions where sensible and trimming activities that are..."
"Elon Musk admits humans are sometimes superior to robots, in a tweet about Tesla delays",13 Apr 2018,"Amid reports of Tesla Model 3 manufacturing slow-downs, missed production targets and manufacturing errors, CEO Elon Musk has stepped up and admitted that,..."
Musk says 'thorough reorganization' underway at Tesla,14 May 2018,"Tesla Inc <TSLA.O> chief Elon Musk told employees on Monday the company was undergoing a ""thorough reorganization"" as it contends with production problems,..."
"How Tesla ""shot itself in the foot” by trying to hyper-automate its factory",1 May 2018,"Warburton's background includes time spent benchmarking vehicle-assembly plants and he states that, in attempting to hyper-automate Model 3 production at its..."
When Will Tesla Hit Its Elusive Model 3 Production Target?,7 Jun 2018,"Tesla now says it ""continues"" to target the 5,000 weekly Model 3 production rates by the end of 2018's second quarter , despite the fact that the original..."
"Whatever happened to that $35,000 Tesla Model 3 you still can’t buy?",25 May 2018,"This week saw Tesla's enigmatic chief executive Elon Musk take to Twitter to announce two more powerful, and more expensive, versions of the auto firm's Model 3..."
Tesla's Elon Musk overhauls management,14 May 2018,"Tesla's Elon Musk overhauls management ... Tesla's Elon Musk has announced a ""thorough reorganization"" amid concerns about the electric carmaker's production..."
Tesla shares sink following disclosures about fatal crash,2 Apr 2018,"The shares opened down 6 per cent to $250.26, adding to the near 12 per cent drop from last week. Tesla's eight-year bond maturing in 2025 fell another 50 cents..."
Tesla chief Elon Musk accuses worker of sabotage,19 Jun 2018,"Tesla chief Elon Musk says an employee carried out ""extensive and damaging sabotage""."
Is Tesla heading for trouble?,1 May 2018,Is Tesla heading for trouble? ... Tesla is facing more questions about its financial viability ahead of its latest results on Wednesday. The electric car-maker is...
Why Tesla can't compete with high-performance car brands,23 May 2018,"Electric cars, while impressive in a straight line, aren't very good for motorsports that required turning more than a few laps or going around corners."
"Hey Tesla, how hard can it be to actually make a car?",22 Apr 2018,"""Its previous models used copious amounts of aluminium, but to cut costs the Model 3 uses steel and that requires a completely different set of manufacturing..."
"Elon Musk says he's back to sleeping at the Tesla factory, tweets 'Car biz is hell'",3 Apr 2018,"Elon Musk says he's back to sleeping at the Tesla factory, tweets 'Car biz is hell' ... Billionaire tech entrepreneur Elon Musk's electric car company Tesla..."
Elon Musk Just Sent an Extraordinary Email to Tesla Employees,23 Apr 2018,"""Going forward, we will be far more rigorous about expenditures. I have asked the Tesla finance team to comb through every expense worldwide, no matter how..."
