Headlines,Dates,Descriptions
Carmakers Envy Tesla's Whole Car OTA,29 Oct 2018,"The one thing every car OEM secretly admires about Tesla is its EVs' ability to do the whole car OTA updates. It sends software patches to a relevant,..."
Can 7-tesla MRI make the transition to clinical prime time?,14 Nov 2018,"More specifically, with 7-tesla MRI, BWH clinicians can see minute central veins within white-matter plaques of the brain's parenchyma. Gray-matter and cortical..."
Tesla Faces a Challenger in the Home Solar Business (Published 2018),28 Oct 2018,Analysts say prices for comparable residential solar systems at Sunrun and Tesla are about the same. But as they move to take advantage of the growing appeal of...
Tesla Model 3 Production Process Simplicity: 40 Steps In 90 Minutes,7 Dec 2018,"""We could see the Model 3 assembled, from an empty body to a fully functional car in a bit more than 40 steps and 90 minutes, on a line about 1,000 feet long,""..."
These Are the Robots Making Your Tesla S Vehicles,2 Nov 2018,"Now, a new video is showing in detail the robots that build the Model S and you will not believe how much these machines do! From tiny ones to huge ones, these..."
Tesla's Navigate on Autopilot review,25 Dec 2018,"Called ""Navigate on Autopilot,"" it enables a Tesla vehicle that's equipped with the requisite set of sensors, cameras, and radars — and that's had ""Enhanced..."
Meet Elon Musk’s new boss at Tesla: Australian telecom exec Robyn Denholm,8 Nov 2018,Meet Elon Musk's new boss at Tesla: Australian telecom exec Robyn Denholm. Denholm's appointment was part of an SEC settlement agreement. ... Catch up on the...
Tesla raises midrange Model 3 price to $46000,24 Oct 2018,"Tesla has raised the price of the midrange Model 3 by $1,000 to $46,000, according to the automaker's online configurator. The midrange Model 3 was only..."
Government to Tesla: We Never Said the Model 3 Was the “Safest Car Ever”,10 Oct 2018,"Participation Trophy. In a blog post published last week, Tesla claimed that its Model 3 was the safest car ever tested by the National Highway Traffic Safety..."
"Despite Making Production Goals, Tesla Grappling With Delivery Issues",2 Oct 2018,Tesla's latest production numbers are out and -- in spite of recent legal trouble for CEO Elon Musk-- the electric car company beat expectations.
Tesla battery will power unusual community storage project in Western Australia,7 Nov 2018,The project is an unusual one because it pools battery capacity for homes with solar panels. It was funded by energy company Synergy and government-owned...
Tesla’s Model 3 and the death of plug-in hybrids: ‘Full electric is a much more elegant solutio...,30 Nov 2018,"Amidst the evident success of the Model 3 and Elon Musk's high-stakes bet on the electric sedan, another class of vehicles has begun to show notable signs of a..."
"Tesla electric vehicles will park themselves in 2019, Elon Musk says",31 Oct 2018,"Tesla cars will be able to find a parking spot on their own in 2019, CEO Elon Musk said Wednesday on Twitter."
Tesla Model 3 With Track Mode Software Upgrade Faster Than Ferrari 458,8 Nov 2018,"""Track Mode"" is a software update to the Tesla Model 3 Performance that enables spirited, unstable driving of the sort that enthusiasts crave."
Car heist video reminds Tesla owners that relay attacks are still a thing,22 Oct 2018,Video shows thieves quickly gaining access to a Model S.
Notre Dame creates new architecture design studio with Tesla,19 Nov 2018,Notre Dame creates new architecture design studio with Tesla ... The University of Notre Dame School of Architecture is collaborating with Tesla Inc. to create a...
Inside Tesla’s ‘tent’-based Model 3 line that set a path to profitability,10 Dec 2018,"Tesla's “tent”-based Model 3 assembly line was featured in Elon Musk's recent segment on CBS' 60 Minutes. While speaking with correspondent Leslie Stahl, Musk..."
Tesla will bring the Model 3 to Europe with a CCS port,14 Nov 2018,"""We'll be continuing to invest in our network – that's a huge part of the ownership experience. But we'll be enabling our owners to have access to the CCS..."
The Verge 2018 tech report card: Tesla,29 Dec 2018,"The year didn't begin well: Tesla had lost $2 billion in 2017 as it got Model 3 production off the ground, and yet the company was months behind its goals for..."
Elon Musk Says Your Tesla Will Earn You Money While You Sleep,25 Oct 2018,Elon Musk envisions a future in which the ride-hailing industry is disrupted by fleets of autonomous Teslas earning money for their owners.
Man Caught On Video Stealing Tesla Parts,30 Oct 2018,A man is caught on video taking off with valuable Tesla parts and now the search is on for that thief. Brittney Hopper reports.
"Tesla cuts $4,000 off Model 3 price with new mid-range battery",19 Oct 2018,"Tesla cuts $4,000 off Model 3 price with new mid-range battery · CEO Elon Musk claims $45,000 version will cost $35,000 — the original target for Model 3 —..."
Tesla's Model X gets a rival as Americans flock to trucks and SUVs,27 Nov 2018,"Rivian has actually been around since 2009, but its founder, 35-year-old MIT grad RJ Scaringe, flies a little further under the radar than Tesla's superstar CEO..."
See Full Video On How To Remove Tesla Model 3 Battery,17 Dec 2018,They're honest to admit that the battery pack removal wasn't as easy as they anticipated it to be. You'll definitely need a lift and some strong mechanical...
Tesla will live and die by the Gigafactory,30 Nov 2018,"The Verge takes a look inside the Tesla Gigafactory, arguably the most important thing the company makes. The 1.9 million-square-foot factory in Sparks,..."
Tesla Model 3 Track Mode Meets the Autocross Course,15 Nov 2018,More than five times (I stopped counting) I had experienced autocrossers stepping out of their own high-horsepower rides to comment on how insane the Model 3's...
Tesla secures 210-acre site for factory in Shanghai,17 Oct 2018,"In July, Tesla told Ars that after obtaining the proper permits, it would take two years to start producing vehicles and another two to three years until the..."
Tesla's Model 3 gets quicker cornering with 'Track Mode',9 Nov 2018,Tesla has just made your Model 3 Performance EV a helluva lot more fun with the launch of Track Mode. The software shuts down all the traction control...
You can now play classic arcade games in your Tesla,8 Oct 2018,You can now play classic arcade games in your Tesla ... Turn on Javascript to see all the available pictures. ... Tesla has made an announcement. About cars.
Tesla adds Larry Ellison to its board,28 Dec 2018,Tesla beefs up its board with executives from Oracle and Walgreens to reassure investors.
Watch a Tesla Model S get stolen with a key fob hack,22 Oct 2018,"The video offers a clear look at a potential vulnerability for cars with keyless entry. Tesla has a few features that can help prevent attacks like these,..."
"Larry Ellison joins Tesla's board as ""independent"" director",28 Dec 2018,"Larry Ellison joins Tesla's board as ""independent"" director ... Tesla is naming Oracle's Larry Ellison and an executive from Walgreens to its board as part of a..."
Tested: 2018 Tesla Model 3 Performance Rules the Passing Lane,25 Oct 2018,"We measured zero-to-60-mph acceleration at 3.5 seconds, 1.6 quicker than the rear-drive Long Range model tested earlier. The Model 3 Dual Motor Performance ran..."
Siemens Healthineers Magnetom Terra 7 Tesla MRI Scanner,4 Dec 2018,The Magnetom Terra 7 Tesla (7T) magnetic resonance imaging (MRI) scanner is an advanced ultra-high-field scanner developed by Siemens Healthineers. It is one of...
Tesla trains firefighters how to put out its battery fires,20 Dec 2018,Tesla trains firefighters how to put out its battery fires · Pull over as quickly as possible · Turn off the engine · Get everyone out of the car · Never return...
Tesla Model S Stolen in Video Posted by Tech Executive Antony Kennedy,22 Oct 2018,Senior tech executive Antony Kennedy posted a YouTube video of his Tesla Model S being stolen on Sunday morning.
"Inside Tesla's factory, a medical clinic designed to ignore injured workers - Reveal",5 Nov 2018,"The on-site medical clinic serving some 10,000 employees at Tesla Inc.'s California assembly plant has failed to properly care for seriously hurt workers, an..."
"Regulators Subpoenaed Tesla Production Data, Company Says",2 Nov 2018,"U.S. securities investigators have subpoenaed information from Tesla about production forecasts for the Model 3 electric car that were made last year,..."
Elon Musk Is Apparently the 'Nothing' of Tesla Now. What Would Work Look Like Without Titles?,30 Oct 2018,Work with no bosses would be fantastic. Or would it? ... Elon Musk's recent decision to remove his title at Tesla got the whole world thinking what it would be...
Tesla Autopilot Hits 1 Billion Miles Driven,28 Nov 2018,Tesla's cars have driven one billion miles with the Autopilot semi-self-driving feature engaged. That's 10% of all Tesla miles driven since 2012.
Tesla's New Stance On Charging Habits + Elon Responds: Video,6 Dec 2018,"They recommended charging to 90 percent daily, despite Tesla CEO Elon Musk recommending, in a tweet from March of 2014 (embedded below), charging to 80 percent..."
Cadillac beats Tesla in Consumer Reports' semiautomated driving system test,4 Oct 2018,"Consumer Reports did just that, comparing the automated driving capabilities of a number of vehicles on the market, including Tesla's Autopilot system,..."
New Hot Wheels Tesla Roadster Toy Celebrates SpaceX-Launched Car,26 Oct 2018,"""Greetings from Space"" reads the postcard-styled backer card for the new Hot Wheels toy. The packaging features a real image of the 2008 Telsa Roadster in orbit..."
Tesla Model 3: How Do Early Production Models Differ From Latest Ones?,30 Dec 2018,"Nevertheless, there are some changes that were implemented as Model 3 production ramped up. To find out, Teslaunity made a quick comparison of an early VIN..."
Tesla's New Board Chair Is Robyn M. Denholm,8 Nov 2018,"Denholm, who has an undergraduate degree in economics from the University of Sydney and a master's degree in commerce from the University of New South Wales,..."
New Tesla Chair Robyn Denholm May Not Hold Elon Musk Accountable,8 Nov 2018,"The issue, as Musk's tweet unintentionally highlighted, is that Denholm has been on the board of Tesla for almost half its life as a public company. This is..."
"Tesla Model S Catches Fire in Los Gatos, Reignites Hours Later at Tow Yard",18 Dec 2018,"A Tesla Model S caught fire Tuesday in a business parking lot in Los Gatos, according to the Santa Clara County Fire Department, then reportedly reignited..."
First look at Tesla's new Enhanced Anti-Theft system,7 Dec 2018,First look at Tesla's new Enhanced Anti-Theft system ... Tesla launched a new 'Enhanced Anti-theft' system as an aftermarket product last month and we now take a...
"Tesla Model X Drag Races Urus, AMG G63, Range Rover Sport SVR",11 Nov 2018,"The main antagonists of this drag race episode of CarWow are one German, one Italian, and one British: the Mercedes-AMG G63, the Lamborghini Urus, and the Land..."
Three charts illustrate how Tesla has transformed the US auto market,31 Oct 2018,Tesla is breaking through and redefining the car market in the US. Three graphs explain how and why.
Tesla Includes Model 3 Performance Upgrade as Standard on Top Version,29 Oct 2018,"The most expensive Model 3, the Dual Motor Performance with all-wheel drive and a 310-mile estimated range, still starts at $65,200 but now includes the..."
Australian exec replaces Elon Musk as Tesla chair,11 Nov 2018,"Tesla has named Australian Robyn Denholm as the new Tesla chair, following the forced resignation of Elon Musk."
Tesla CEO Elon Musk Is Getting Last Laugh on Wall Street,12 Dec 2018,It was only a few months ago that Wall Street was bashing Elon Musk's Tesla Inc. Times have changed for the automaker and its mercurial CEO.
Tesla's Model 3 just got a bit more affordable,19 Oct 2018,"Tesla's Model 3 just got a bit more affordable ... FBN's Charlie Gasparino on how bankers are approaching Tesla executives with financing ideas, as debt Video."
"Tesla Model 3 1,000-Mile Road Trip: Total Charging Time And Cost",27 Nov 2018,"YouTuber Andy Slye sets out on a 990-mile road trip to share how much time it takes him to charge, as well as the total cost involved. He notes that he charged..."
Tesla opens Model 3 orders in several more European markets,21 Dec 2018,The Model 3 Long Range Dual Motor all-wheel-drive and the Model 3 Performance version are still the only two options available to order in Europe.
Tuned Tesla Model S P100D Goes Dark,7 Nov 2018,"This particular vehicle is a Tesla Model S P100D. Coming with a well-familiar dual-motor setup, the P100D excels in straight line performance. The vehicle uses..."
Tesla sets Monday deadline for 2018 delivery—and $7500 tax credit,12 Oct 2018,"When Tesla crossed the 200,000 threshold in July, it started the clock on an 18-month phase-out process. All vehicles sold in the second half of 2018 are..."
What it's like to use Tesla's newest self-driving car technology,31 Oct 2018,"This week's free software update for Tesla cars with Enhanced Autopilot gives them the ability to drive autonomously on and off highway exit ramps,..."
"Elon Musk Talks Tesla, Twitter, and His ""Excruciating"" 2018 with Recode",2 Nov 2018,Culture. Evan is a senior editor with InsideHook who earned a master's degree in journalism from NYU and has called Brooklyn home since 2006.
Robyn Denholm: the Woman Taking Over From Elon Musk As Telsa's Chair,10 Nov 2018,Robyn Denholm is replacing Elon Musk as chair of Tesla after he was forced to step down by the SEC.
2019 Tech Predictions: Tesla Model Y Launch Will Cement EVs in Mass Market,16 Dec 2018,2019 Tech Predictions: Tesla Model Y Launch Will Cement EVs in Mass Market. The sports utility vehicle will show electric cars are now mainstream. ... The Tesla...
"Tesla's Manufacturing Complexity to Blame for Thin Profit Margins, Says Analyst",18 Oct 2018,"After itemizing the cost of materials required to produce the Model 3, Munro estimates that it may only cost around $2,000 more to source parts than what it..."
Tesla remotely extends car batteries to help with Hurricane Michael,10 Oct 2018,"Tesla says that some customers in Florida, Alabama, Georgia, South Carolina, and North Carolina will get the free, temporary battery upgrade. In addition, all..."
"Tesla's giant battery saved $40 million during its first year, report says",6 Dec 2018,"Tesla's giant battery saved $40 million during its first year, report says ... Neoen, the owner of the giant Tesla battery system in South Australia, released a..."
Tesla reduces price of Model 3 Performance [Updated: Elon Musk makes it right],26 Oct 2018,"Just a mere two months into production, Tesla has reduced the price of the Model 3 Performance Upgrade Package by $5k, effectively making it free now."
Tesla Model 3 receives updates,28 Oct 2018,"Finally, the exact battery capacity for the new mid range Model 3 has been reported by electrek. It stands at 62 kWh, compared to the 74 kWh battery in the long..."
"Tesla Releases a $35,000 Model 3 After Rebates",18 Oct 2018,The electric-car company is releasing a midrange version of its Model 3 sedan that will cost $35000 after federal and state tax rebates.
Green Car Reports Best Car To Buy 2019: Tesla Model 3,12 Nov 2018,"The Tesla Model 3 is Green Car Reports' Best Car To Buy 2019. It's the second time a Tesla product has won our annual award, which was captured by the Tesla..."
Another Tesla with Autopilot crashed into a stationary object—the driver is suing,30 Oct 2018,Florida man says Tesla oversold Autopilot's capabilities. ... The front of Tesla owner Shawn Hudson's car was totally destroyed. Hudson survived the crash. Shawn...
"Tesla CEO Elon Musk: ""I have no respect for the SEC"" - 60 Minutes Interview",9 Dec 2018,The Tesla cofounder got in hot water with the Securities and Exchange Commission this summer and explains to Lesley Stahl how his tweeting has been reined...
"Elon Musk Tried to Bring ""Mario Kart"" to Your Tesla Model 3",30 Nov 2018,Elon Musk revealed he tried to get a license to Mario Kart for Tesla cars. But Nintendo didn't play ball.
"General Public Can Now Order Own Tesla Model 3, S & X Parts",29 Oct 2018,"Tesla just released to the general public a Parts Catalog with all parts for all four of its cars (Model S, Model X, Model 3 and the first-generation..."
Meet the ‘rational’ person who's picked to temper Tesla’s mercurial Musk,9 Nov 2018,"Synopsis ... SAN FRANCISCO: In picking Robyn Denholm to keep Elon Musk in check, Tesla's board went with a numbers-first executive who climbed up the ranks of..."
Listen to a Tesla make 6 farting noises on demand,19 Dec 2018,"Hopped in my @Tesla this morning and was delighted to find “romance mode” and a drop-down list of juicy, on demand fart noises, that can be triggered with a..."
Tesla's got a new boss. But can Robyn Denholm fix Elon's mess?,8 Nov 2018,"Tesla's got a new boss. But can Robyn Denholm fix Elon's mess? · Tesla's got a new boss. · Robyn Denholm now has the unenviable job of keeping Musk in line, and..."
"Tesla, The Model 3... And The Market",4 Aug 2018,"The Model 3 was a challenge for Tesla from the start: its first car aimed at middle- and upper-middle-class families, with a starting price of $35,000, the..."
Elon Musk Has Some Fun With Tesla,8 Aug 2018,"Assuming, somewhat recklessly, that someone has told him this and that he listened, then the most reasonable conclusion would seem to be: Elon Musk is really..."
Tesla: Most shorted stock ever?,16 Aug 2018,"The peak short balance in Tesla, just over $13bn, was observed on August 7th, the same day as the blog post, and equates to just over 20% of the firm's market..."
Porsche and Jaguar EVs loom in Tesla’s rear-view mirror,15 Aug 2018,"Sales for the Model S and Model X are slowing, though Tesla says demand is high and battery-cell supplies have constrained deliveries."
"Tesla hits 200000 cars, meaning lower tax credit for buyers",12 Jul 2018,"Tesla Inc has delivered 200000 electric cars to buyers in the United States, a spokesperson said on Thursday, meaning tax credits will now begin to be..."
Why is Tesla a Short-Selling Target?,13 Aug 2018,Why is Tesla a Short-Selling Target? · Tesla has the highest utilization rate among US large-cap companies · US companies with high exposure to short interest...
"Elon Musk: Tesla could produce a $25,000 car in around 3 years",18 Aug 2018,Elon Musk estimated Tesla could make a cheaper electric car starting at $25000 in perhaps three years if they worked really hard.
Tesla shares sink after key executives exit,7 Sept 2018,The resignations come hours after the firm's chief executive Elon Musk smoked marijuana live on the web.
"Tesla: ladies, liquor and leverage",22 Aug 2018,"The rationale is that inventories, and other current assets, take longer to convert into cash than, say, investments, so the ratio gives a better picture of the..."
Tesla Q2 2018 Vehicle Production and Deliveries,2 Jul 2018,"PALO ALTO, Calif., July 02, 2018 (GLOBE NEWSWIRE) -- In the last seven days of Q2, Tesla produced 5031 Model 3 and 1913 Model S and X vehicles."
Tesla might go private. Here's what that would mean if you own its stock,8 Aug 2018,"If you've held the stock for less than a year, you'd pay ordinary income tax rates on that profit. If you've held it for longer, you'd be taxed at long-term..."
"Elon Musk Interview on Tesla, Twitter, Model 3 Factory",13 Jul 2018,An in-depth conversation with Tesla's chief executive on his scars from a year in hell and trying to be nicer on Twitter.
Tesla makes more cars as revenue jumps,1 Aug 2018,"Tesla delivered more of its Model 3 cars in the most recent quarter, helping to boost revenues. Elon Musk's electric car company had revenues of $4bn in the..."
Tesla sheds $6bn in value after Musk accused of securities fraud,28 Sept 2018,Shares down 12% in Wall Street trading as investors fret over CEO's future.
"Tesla Investor's Model 3 Production Over/Under Around 4,500 Cars Per Week",1 Jul 2018,"There are multiple estimates of how many Model 3's Tesla was making at the end of June. Expectations seem to be around the mid-4,000 vehicles being produced."
Tesla shareholders who sell if Musk takes electric-car maker private will be big losers for one reason: A.I.,10 Aug 2018,"Tesla shares have been on the move ever since Elon Musk said he may take the company private at a valuation of $420 per share, a $71 billion deal."
Tesla: Elon Musk floats plans to take carmaker private,7 Aug 2018,"Tesla's Model S (left) and Model X are both priced at more than $70,000. Tesla boss Elon Musk is considering taking the electric-car firm private, a move he..."
How Tesla's Model 3 Became Elon Musk's Version of Hell,12 Jul 2018,Tesla claims this is the world's first front seat assembly line in which no humans are involved at all. The plan is eventually to use Musk's tunnel-digging...
Elon Musk’s Bombshell Tweets About Taking Tesla Private Trigger SEC Review,8 Aug 2018,"“Typically, a company would disclose this kind of news via a detailed press release while the market is closed or halt their stock in advance of the..."
Mercedes takes on Tesla with fully-electric SUV,5 Sept 2018,"The German car giant unveils its first fully-electric luxury model, with a range of 450km."
YouTube star referred over $12 million in Tesla sales and got 2 free cars,22 Aug 2018,"Using his YouTube channel Teslanomics to help make car sales, Ben Sullins scored the top prize available from Tesla's referral program: two free Roadsters."
Saudi Arabia's sovereign fund builds $2bn Tesla stake,7 Aug 2018,"Saudi Arabia's sovereign fund builds $2bn Tesla stake ... Roula Khalaf, Editor of the FT, selects her favourite stories in this weekly newsletter. Saudi Arabia's..."
What Tesla's Spygate Teaches Us About Insider Threats,19 Jul 2018,"If this is true, this insider was able to damage several critical aspects of Tesla's business operations simply because too much access and privilege was..."
Tesla's Struggles Are A Threat To The Future Of Electric Cars,19 Jul 2018,"The transition to EVs is increasingly dependent on the success of Tesla, with the company likely to account for 60% of all EVs sold in the U.S. by the end..."
Elon Musk calls Tesla 'a real car company',2 Jul 2018,"Elon Musk calls Tesla 'a real car company' ... Tesla is finally ""a real car company"", chief executive Elon Musk has said, after hitting a target to build 5,000..."
"Elon Musk says taking Tesla private is 'best path,' shares jump",7 Aug 2018,"Chief Executive Elon Musk said on Tuesday he is considering taking Tesla Inc private in what would be the largest deal of its type, moving the electric car..."
"Apple hired scores of ex-Tesla employees this year, and not just for its car project",23 Aug 2018,Former Tesla employees are joining Apple in high numbers as the hardware juggernaut embarks on tighter controls of its manufacturing.
Tesla investors should focus on Elon Musk's related-party history,20 Aug 2018,"And the bond deal prefigured a much bigger related party arrangement: Tesla's buyout of SolarCity for $2.6bn in 2016, a deal that is now the subject of..."
"Tesla will meet its Model 3 goal so buy the stock, Oppenheimer says",6 Sept 2018,"Oppenheimer reiterates its outperform rating for Tesla shares, citing confidence in the carmaker's ability to meet its third-quarter Model 3 production..."
This man was so fed up trying to get his Tesla fixed that he ended up doing it himself,28 Aug 2018,"Once Greg Furstenwerth's Tesla Model S was out of warranty, he took on the repairs himself and found it surprisingly easy."
Tesla shares drop as much as 13% after SEC charges CEO Elon Musk with fraud,27 Sept 2018,Shares of Tesla dropped sharply in after-hours trading Thursday after court documents showed the Securities and Exchange Commission is suing Elon Musk for...
"NIO Has the Electric-Car Look, But It's No Tesla",3 Sept 2018,"Under the fancy accessories, NIO doesn't make even make the dress. Its cars are manufactured by state-backed Anhui Jianghuai Automobile Group Corp., or JAC, at..."
Tesla to open gigafactory in Shanghai,10 Jul 2018,"According to the report, Tesla's Shanghai Gigafactory will have capacity to produce 500,000 electric vehicles per year, as well as conduct research and..."
"10 Years After 1st Car, Tesla Production Rate = 300,000–400,000* Cars A Year",22 Sept 2018,"10 Years After 1st Car, Tesla Production Rate = 300,000–400,000* Cars A Year · Latest CleanTechnica TV Video · Zachary Shahan · Related articles. Fast..."
Elon Musk attacks Thai cave rescuer in angry tweet,15 Jul 2018,Tesla founder risks serious backlash with unsubstantiated insults.
Interactive Brokers increases margin requirement for Tesla,27 Jul 2018,Interactive Brokers Group said on Friday it will increase margin requirements for clients making Tesla Inc bets due to recent volatility in shares of Elon...
Tesla owner frustrated so repairs his own Model S and says it's easy as 'Legos',28 Aug 2018,"Greg Furstenwerth was an early adopter of the Tesla Model S, but once the car was out of warranty he had a hard time getting the parts and service he needed..."
Tesla tests the pros and cons of public markets,8 Aug 2018,"Impatience with the constraints of public markets is not on its own a good reason to quit them. In fact, given the well-publicised management flaws at Tesla,..."
