Headlines,Dates,Descriptions
Hong Kong's interest in Tesla cars dims as insurance premiums surge,18 Oct 2018,"According to a spokeswoman for AXA in Hong Kong, a “commercial decision” was behind its termination of insurance policies for Tesla vehicles, due to the fact..."
Guess What? Everyone Was Wrong About Tesla,28 Oct 2018,"Virtually everyone was wrong about Tesla's finances and its future, and many analysts are now scratching their heads trying to understand what happened while..."
"Tesla expects to invest up to $6 billion over next two years in factories and equipment, ramps up production in China",2 Nov 2018,The electric car maker said it expects to spend just under $2.5 billion in capital investments for 2018 and $2.5 billion to $3 billion annually over the next...
Tesla hints at seeking new battery suppliers in blow to Panasonic,20 Nov 2018,"While both sides had known this was a possibility, it is nevertheless a blow to Panasonic's battery business, which will now face greater competition from..."
Tesla (TSLA) 3Q Earnings: The Stock Demands More,24 Oct 2018,"We aren't going to know about that for a quarter or two at least. Still, Tesla's stock jumped 11 percent in after-market trading anyway. At about $320 a share,..."
Which 13 electric SUVs are taking on Tesla's Model X?,12 Oct 2018,"The battery-powered Model X triggered a stampede among rivals to be the first to produce a viable alternative, with different marques now hitting the..."
Tesla picks telecoms executive to replace Elon Musk as chair,8 Nov 2018,"Tesla has picked one of its independent board members to take over as chairman from founder Elon Musk, turning to an Australian outsider to provide a check..."
Industrial Robots vs. Humans in Manufacturing at Tesla (and Elsewhere),16 Oct 2018,"Elon Musk recently admitted that he put too much faith in industrial robots for manufacturing the Tesla 3. So, what are the ramifications for the rest of..."
"Tesla, You Have Just Made The Leadership Hire Of The Year",8 Nov 2018,"Robyn Denholm may bring a bold, fresh leadership style that will be a much-needed antidote to Elon Musk's approach."
Tesla cuts China car prices to absorb hit from trade war tariffs,22 Nov 2018,"Tesla is cutting the price of its Model X and Model S cars in China, the U.S. firm said on Thursday, in a shift in strategy that will see it take more of a hit..."
Tesla's Latest Rival Looks a Lot Like Its German Alter Ego,20 Dec 2018,Ambitious startup is ramping up production of a cheap electric car for the masses.
The EV Resistance: A Tesla Model 3 Hater (And Car Guy) Explains,10 Nov 2018,I'm sure many readers believe that they could take apart his argument (as I try to do whenever we get into it) — but that's not the point. The point being that...
Tesla is seeking $167 million in damages from the former employee Elon Musk accused of sabotage,11 Dec 2018,Tesla's legal battle with ex-employee Martin Tripp is turning even more acrimonious. The electric vehicle maker is now seeking $167 million in damages from...
Tesla's Model 3 Passes the 100000 Mark,12 Oct 2018,"Tesla's Model 3 Passes the 100,000 Mark. But with the production uptick shown by Bloomberg's Model 3 tracker comes an end to the $7,500 U.S. tax credit—on..."
Why Elon Musk Is Key To Tesla's Success,8 Oct 2018,"Why Elon Musk Is Key To Tesla's Success · Scale: While revenues have grown, gross profit has plateaued, indicating the costs associated with increased revenues..."
"Elon Musk's extreme micromanagement has wasted time and money at Tesla, insiders say",19 Oct 2018,"This anecdote is emblematic of Musk's management style, Tesla insiders told CNBC. Interviews with 35 current and former employees depict an ambitious CEO whose..."
Dyson Picks Singapore to Build Electric Cars Rivaling Tesla,23 Oct 2018,"Dyson Ltd., famous for making vacuum cleaners, picked Singapore to manufacture its first electric car, pushing ahead with plans to challenge Tesla Inc. in..."
Tesla's head of global security is out after 11 months,27 Nov 2018,"Tesla head of global security, Jeff Jones, a veteran of the U.S. secret service and Uber, is no longer with the electric vehicle maker."
"The Key For Tesla's Future Is Batteries, Not Cars",7 Dec 2018,Battery manufacturing is set to become one of the most important industries on the planet. Stop seeing Tesla as a carmaker and start understanding that the...
Tesla Says Faster Autopilot Chip Is Months Away,16 Oct 2018,Tesla CEO Elon Musk says a faster chip controlling its Autopilot system will be available within six months.
"Elon Musk: Tesla's work 'supersedes political parties, race, creed, religion'",6 Nov 2018,"“Tesla cannot die. Tesla is incredibly important for the future of sustainable transport and energy generation. The fundamental purpose, the fundamental good..."
Audi just unveiled its challenge to the Tesla Model S,29 Nov 2018,Audi just unveiled its challenge to the Tesla Model S · Audi lays down its marker in the luxury electric Sedan market. · The e-tron GT is to be in full...
"Tesla reportedly achieves Model 3 production rate of 1,000 a day",30 Nov 2018,"Tesla reportedly achieves Model 3 production rate of 1,000 a day · Tesla has reached a daily production rate of 1,000 Model 3 cars per day, said a report from..."
Tesla's Third Largest Shareholder Says It's Willing to Inject More Capital into EV Maker,30 Oct 2018,"Shares of Tesla Inc. (TSLA) have been on a roll over the past couple of weeks, reversing some major declines caused by investors' concerns regarding the..."
High-tech thieves used a relay attack to steal a Tesla Model S,23 Oct 2018,"The Tesla Model S owner did not enable the PIN to Drive security feature, so hackers were able to use a tablet and phone to capture the signal from the fob..."
Forget Elon Musk's Troubles—Tesla Had a Blockbuster 2018,24 Dec 2018,"If you focus on Tesla the company, then 2018 has been very good indeed. And it couldn't have come at a better time: Musk himself admitted that a successful ramp..."
Elon Musk Said Tesla Was 'Single-Digit Weeks' From Death -- Where Are The Disclosures?,28 Nov 2018,In March Forbes contributor Jim Collins wrote that Musk needed to sell stock soon as the financial noose tightened. Wall Street was giving Musk plenty of cover.
Demand for Tesla Model 3 'looks very strong into 2019 and beyond': Analyst,26 Dec 2018,"Consumer demand for the Tesla Model 3 reduces the risk Tesla will need to raise capital in the near future, said Wedbush Securities analyst Dan Ives."
Tesla cuts Model 3 prices in China,24 Dec 2018,Tesla has slashed prices on its Model 3 electric car in China.
Police Stop Tesla Vehicle with Driver Sleeping Inside,11 Dec 2018,California police say they were able to stop a Tesla vehicle that was speeding with the driver sleeping inside. Officers said the Tesla's Autopilot driver...
Why you can't buy a Tesla in these states,15 Oct 2018,"Answer #1: Franchise laws. The first reason for the state bans: Tesla insists on operating its own dealerships, rather than offering franchises (local..."
How can Elon Musk make money? Analysts answer after tearing apart Tesla car,17 Oct 2018,Tesla has the advantage when it comes to knowledge from Silicon Valley that other carmakers don't have.
Tesla's Enfant Terrible Needs to Grow Up,11 Dec 2018,"Tesla's Enfant Terrible Needs to Grow Up. Watching Elon Musk's recent appearance on 60 Minutes, Yale SOM's Jeffrey Sonnenfeld concluded that the Tesla CEO is..."
Elon Musk: Tesla had 'single-digit weeks' as it teetered on brink of collapse,25 Nov 2018,"Tesla CEO Elon Musk says the company was close to death earlier this year as it worked through a production ramp for the Model 3. ""Essentially, the company..."
Even A 2-Year-Old Kid Can Learn To Drive Electric! (Mini Tesla Review),25 Nov 2018,"Thanks to Paul Fosse, the Tesla referral program, and Radio Flyer, Lily and Julia were recently gifted a torque-happy, stylish, non-Autopilot Model S P90D. ... Ah..."
U.S. Agency Warns Carmakers on 'Safest' Label After Tesla Boast,9 Oct 2018,The National Highway Traffic Safety Administration is taking exception to Tesla Inc.'s characterization of the agency's safety ratings.
Tesla Stock Rises as the End of Elon Musk’s Time as Chairman Nears,16 Oct 2018,"Oh, happy day? For Tesla (ticker: TSLA) investors, at least, it seems to be. Shares of Elon Musk's company were ahead more than 6.5% in Tuesday trading..."
Short seller Fahmi Quadir Says Tesla Reminds Her of Valeant Crash,10 Oct 2018,"Short seller Fahmi Quadir, who bet against the drugmaker formerly known as Valeant Pharmaceuticals around its peak in 2015, is now betting on a dramatic..."
Elon Musk buys $10 million in Tesla shares and plans to purchase $20 million more next week,30 Oct 2018,"Tesla CEO Elon Musk purchased $10 million worth of shares in the electric car company on the open market, according to a new filing on Tuesday."
Tesla class action judge is reconsidering lead plaintiff in fraud case,17 Dec 2018,"Levi & Korsinsky represents an individual Tesla investor, Glen Littleton, who claims to have lost $3.5 million in Tesla investments as a result of Musk's tweet..."
Elon Musk tweets fans might see a Tesla pickup truck in 2019,14 Dec 2018,Elon Musk tweets fans might see a Tesla pickup truck in 2019 · I'm dying to make a pickup truck so bad … we might have a prototype to unveil next year · What...
"Elon Musk says Tesla would consider buying idled GM plants, takes another swing at the SEC on '60 Minutes'",9 Dec 2018,"In a wide-ranging interview on CBS, Tesla CEO Elon Musk says he would consider buying some of the plants that General Motors plans to wind down."
How taxpayers have boosted Elon Musk and Tesla,22 Oct 2018,"Elon Musk is not alone in going after government dollars, but his major companies have gotten significant taxpayer support in different forms."
Tesla Makes Good On Elon Musk’s Promise As Model 3 Drives $312 Million Profit,24 Oct 2018,Tesla Makes Good On Elon Musk's Promise As Model 3 Drives $312 Million Profit ... I write about advanced transportation and climate-oriented technology. Following
Tesla Model 3 Teardown: Why the Newest Car Risks Missing Profits,17 Oct 2018,The Model 3 not only goes farther on a charge—it's a lot faster due to the advanced electric motor. Tesla's motor costs $754 a car compared to $836 for the Bolt...
Ark Invest CEO: Tesla 'is a replay of Apple',15 Oct 2018,"“This is a replay of Apple,” she added. “Apple was moving so fast with the smartphone that it had to design its own chip to move that fast. This is what has..."
"Tesla's pick for a new chairwoman is boring, but that's exactly what the company needs",8 Nov 2018,Tesla 's newly appointed chairwoman Robyn Denholm will bring business expertise to the helm of the company's board and serve as a crucial counterbalance to CEO...
Tesla is getting a new top lawyer,7 Dec 2018,"A top lawyer at Tesla, Todd Maron, is leaving the company to be replaced by seasoned trial lawyer Dane Butswinkas, chairman of Williams & Connolly."
Tesla Scrambles to Sell Cars Before a Tax Break Fades (Published 2018),28 Dec 2018,"Demand for the company's electric cars could weaken in January, when a $7500 federal tax credit is cut in half for buyers of Tesla's luxury models."
Tesla Survived Manufacturing Hell--Now Comes The Hard Part,20 Dec 2018,Elon Musk claims that Tesla has moved beyond manufacturing hell and soon will overcome distribution & logistics hell. But the company's biggest challenge...
Tesla Staff Worked 100-Hour Weeks to Build Model 3: Elon Musk,2 Nov 2018,"Beyond the CEO, though, Musk said ""everyone"" at Tesla was working 100-hour weeks in 2018 in an effort to ramp up production of the company's most recent car,..."
"If you invested $1,000 in Tesla in 2010, here's how much you'd have now",12 Dec 2018,"If you invested in Tesla in 2010, when it made its initial public offering, that investment would definitely have paid off. A $1,000 investment would be worth..."
Tesla is turning to partners to help with a growing used-car business,19 Nov 2018,"To manage a growing used car business, Tesla is relying on outside firms, including Manheim and Adesa , according to two people familiar with the situation."
Tesla focuses on building e-commerce team at Fremont Kato Road facility,19 Nov 2018,"New car shoppers are increasingly turning to Tesla ($NASDAQ:TSLA) as it diversifies its vehicle catalog, makes its cars more affordable, and simply makes..."
Tesla Traders Bet Stock Will Keep Soaring Higher,1 Nov 2018,(Note: The author of this fundamental analysis is a financial writer and portfolio manager. He and his clients own shares of TSLA.) Tesla's Inc. (TSLA)...
`Tesla Stretch' Pushes Customers to Open Wallets for Model 3s,16 Nov 2018,"`Tesla Stretch' Pushes Customers to Open Wallets for Model 3s ... A Tesla Motor Inc. Model 3. ... This article is for subscribers only. For Earl Banning, getting..."
Your Tesla Can Go Zero to 60 in 2.5 Seconds But Can't Get AM Radio,6 Nov 2018,"The problem, experts said, is that electric-vehicle motors generate electromagnetic frequencies on the same wavelength as AM radio signals. That creates the..."
Tesla names director Denholm to replace Musk as board chair,8 Nov 2018,"Tesla Inc has named director Robyn Denholm as board chair, fulfilling a demand by the U.S. Securities and Exchange Commission to strip the job from Elon..."
Rivian Wants to Do for Pickups What Tesla Did for Cars,26 Nov 2018,"Rivian Wants to Do for Pickups What Tesla Did for Cars. RJ Scaringe's Rivian Automotive just unveiled its electric pickup truck, and it's looking good. ... New..."
A Sleeping Tesla Driver Highlights Autopilot's Biggest Flaw,3 Dec 2018,California Highway Patrol officers used a clever trick to stop a Tesla going 70 mph with a sleeping man at the wheel.
Dr. Elon & Mr. Musk: Life Inside Tesla's Production Hell,13 Dec 2018,"Dr. Elon & Mr. Musk: Life Inside Tesla's Production Hell · The young Tesla engineer was excited. · Musk was spending the weekend in the Gigafactory, attempting..."
Tesla's Elon Musk says tweet that led to $20 million fine 'Worth It',27 Oct 2018,Tesla Inc <TSLA.O> Chief Executive Elon Musk said the tweet that cost him and the company $20 million in fines each by the U.S. Securities and Exchange...
"Thrills, Frills And Foibles Of New Mid Range Tesla Model 3",23 Dec 2018,That's mostly a good thing but it does mean that a thief can lower the seats and get into the rear trunk. But at least there's also a front trunk for laptops...
A Florida Man Is Suing Tesla for a Scary Autopilot Crash,30 Oct 2018,A Florida Man Is Suing Tesla for a Scary Autopilot Crash. The latest lawsuit over Elon Musk's semi-autonomous driving feature claims Tesla sales reps oversold...
Surprise! Tesla Is Quietly Taking Over the Luxury Car Market,26 Oct 2018,"Embedded in these stats is a fact that might not please Elon Musk: With a starting price of $49,000 the Tesla Model 3--while much more affordable than the..."
"Tesla Finally Makes a Profit While Increasing Model 3 Production, and Promises to Keep Doing It",24 Oct 2018,"Tesla now says it makes a 20 percent gross profit margin on the Model 3, which is up there with luxury trucks and cars, and higher than most cheaper cars. Much..."
Tesla Is the Hot Spot for Young Job Seekers,25 Nov 2018,"Despite long hours and frenetic pace, a job at Elon Musk's electric-car company is a career break many idealistic engineers find impossible to pass up."
Tesla is slashing its prices in China again,22 Nov 2018,Tesla Model S and Model X prices have been slashed by up to 26% in China despite higher tariffs on US cars.
Indian Ex-Tesla Employee Charged In $9.3 Million Fraud,13 Nov 2018,"A 32-year-old Indian man, a former employee at American electric car manufacturer Tesla, has been charged for allegedly stealing USD 9.3 million from the..."
"Tesla Will Stop Offering 'Many' Interior Options for Model S, Model X",23 Oct 2018,"Tesla CEO Elon Musk said on Tuesday that ""many"" interior options for the Model S sedan and Model X SUV will no longer be available after November 1 to..."
Robyn Denholm replaces Elon Musk as Tesla's board chair,8 Nov 2018,Tesla said Robyn Denholm has taken Elon Musk's place as chair of the company's board.
"3 predictions for the future, according to billionaire tech titan Elon Musk",31 Dec 2018,"3 predictions for the future, according to billionaire tech titan Elon Musk · In 7 to 10 years, the first humans will colonize Mars · You will be able to..."
"Startups, old-line automakers aim to take bite out of Tesla",26 Nov 2018,"This Wednesday, Nov. 14, 2018, photo shows Rivian R1T at Rivian headquarters in Plymouth, Mich. The company, which plans to start selling vehicles in two..."
Police can remotely drive your stolen Tesla into custody,19 Nov 2018,"When you call the police, they ask your permission for a “takeover,” which you promptly give them. Next thing you know, your car is driving itself to the..."
Tesla to Start Making Cars at China Factory in 2019,24 Oct 2018,Tesla said on Wednesday that it will accelerate its production timeline at its upcoming factory in Shanghai. The automaker said it plans to begin parts of...
Tesla launches new $45000 Model 3 electric car,19 Oct 2018,"BENGALURU: Tesla on Thursday introduced a new $45000 version of its Model 3 sedan on its website, launching the car as US tax breaks for Tesla cars are..."
Elon Musk Blames Missed Model 3 Production Targets on Stupidity,9 Dec 2018,"Tesla CEO Elon Musk had no way of knowing how long it would take to make the Model 3, he said on Sunday evening during a 60 Minutes interview."
"David Einhorn Blasts Tesla, Likens it to Lehman",8 Oct 2018,Einhorn likened Tesla to a famous flop from the financial crisis: Lehman Brothers.
Video: Tesla history does not begin with Elon Musk,15 Nov 2018,"Named after Serbian-American inventor Nikola Tesla, the company was initially fueled by Eberhard's love of speedy two-seaters, interest in battery technology..."
Tesla Through the Lens of Apple - ARK Invest,17 Oct 2018,"Tesla ressemles Apple in three areas: vertical integration, product ramp inflection, and a business model moving from hardware to Mobility-as-a-Service."
"Tesla delivers profit: 'Many argued' it was 'impossible,' CEO Elon Musk says",24 Oct 2018,"Tesla delivered a rare quarterly profit as the company ramped up production of its Model 3 electric car, prompting CEO Elon Musk to celebrate."
Why Tesla Could Do Better Than James Murdoch for Chairman (Published 2018),11 Oct 2018,Mr. Murdoch is one of only three Tesla directors who safely qualify as independent: The others have too much history with Mr. Musk. Mr. Murdoch also has...
Tesla Releases New Autopilot “Navigate” Feature,29 Oct 2018,"The human being behind the wheel must still stand ready to supervise, to intervene, and to initiate any lane changes, by flicking the turn stalk."
Tesla is “absorbing” part of import tariffs to lower Model S and X prices in China,22 Nov 2018,"In a statement to Reuters, Tesla noted that the company would be lowering the prices of its vehicles in the country by “absorbing” part of the 40% import..."
How Tesla creates Creative Innovations,14 Dec 2018,"Elon Musk, the owner of Tesla, leads his employees by indoctrinating innovative problem solving skills to let every employee think outside the box and always..."
Elon Musk is telling customers to use an unusual loophole if they want to take a Tesla car for a three-day 'test drive ...,27 Oct 2018,Tesla CEO Elon Musk touted on Twitter a way customers can essentially get a three-day test drive of one of the company's electric cars.
8 “Impossible” Goals Tesla Achieved,14 Oct 2018,"8 “Impossible” Goals Tesla Achieved · 1. An electric car that goes over 200 miles, goes from 0–60 mph in under 4 seconds, and looks great. · 2. A 4-door sedan..."
Tesla’s latest rival looks a lot like its German alter ego | Mint,20 Dec 2018,e.GO Mobile AG is ramping up production of a battery-powered compact that will cost about half as much as the Tesla Model 3 but unlike the California...
"The Name 'Tesla' Was Taken. Elon Musk and His Co-Founders Bought It for $75,000",9 Dec 2018,The Name 'Tesla' Was Taken. Elon Musk and His Co-Founders Bought It for $75000.
Tesla Cut the Price of Its Model 3 in China,23 Dec 2018,BEIJING (Reuters) — Tesla Inc has slashed prices on its Model 3 electric car in China. According to the California-based electric carmaker's Chinese website...
Elon Musk's Twitter Account Is Tesla's $40 Million Marketing Platform. 'Worth It',30 Oct 2018,Elon Musk's Twitter Account Is Tesla's $40 Million Marketing Platform. 'Worth It'. Helen A. S. Popkin.
"Tesla's Main Product Isn't Cars, It's Subsidies",5 Nov 2018,"Tesla (TSLA) received $713 million in U.S. subsidies in Q3, compared to its $312 million profit."
Will Tesla Model 3 Demand Blast Off in 2019? Or Fall Flat?,18 Oct 2018,"Will demand for Tesla's Model 3 electric sedan continue to grow, or has it essentially peaked? That's one of many existential questions haunting Elon Musk's..."
Why almost everyone was wrong about Tesla's cash flow situation,26 Oct 2018,"Each time Tesla has begun work on a new vehicle, cash flow has turned sharply negative as Tesla spent heavily to design the vehicle and build up its..."
Tesla's new chair's biggest task: Reining in an erratic CEO,9 Nov 2018,"""I believe in this company, I believe in its mission and I look forward to helping Elon and the Tesla team achieve sustainable profitability and drive long-term..."
'Undeniable success': South Australia's 129MWh Tesla battery,6 Dec 2018,"'Undeniable success': South Australia's 129MWh Tesla battery ... Hornsdale Power Reserve (HPR), the 129MWh battery energy storage system (BESS) deployed by Tesla..."
Tesla earns its first profit in two years,24 Oct 2018,"Tesla reported a profit in the third quarter, reversing seven consecutive quarters of losses. It is only the third time in its history that it has."
What Tesla Needs From Its New Chairman: Specialized Knowledge And The Chutzpah To Stand Up To Musk,5 Nov 2018,What Tesla Needs From Its New Chairman: Specialized Knowledge And The Chutzpah To Stand Up To Musk · Experience With Complex Systems · A Background In Software.
"Nio ES6 Debuts in China: Pictures, Video, Specs, Tesla of China",18 Dec 2018,"The electric ES6 pulls in one level below the ES8. Whereas that SUV was designed to compete with the likes of the Tesla Model X, the smaller ES6 lines up with..."
Wirsol and Edify build Tesla battery retrofit at 60MW solar farm in Victoria,9 Nov 2018,"Wirsol Energy, the Australian arm of the Wircon Group, and Edify Energy both own the 25MW/50MWh retrofit Gannnawarra Energy Storage System (GESS), which was..."
Firefighters work 16 hours to put out fires in Tesla Model S,20 Dec 2018,"Firefighters work 16 hours to put out fires in Tesla Model S. A Tesla Model S bursts into flames twice in one day, sparking an investigation. ... The Model S went..."
"Meet Tesla's New Chairman, Who Has to Oversee Elon Musk",8 Nov 2018,Robyn Denholm has served on Tesla's board since 2014 but has fewer ties to Mr. Musk than most of the company's directors.
"Tesla starts taking orders for shorter-range $45,000 Model 3",19 Oct 2018,"While Tesla is making the Model 3 more accessible to some buyers, the starting price for sedans with the long-range battery is rising to $54,000. This iteration..."
Tesla's on-site health clinic accused of undercounting worker injuries,6 Nov 2018,"Share this story ... The on-site health clinic at Tesla's Fremont, California factory prioritized underreporting workplace injuries over proper treatment and..."
Tesla mothballs 'full self-driving capability' option,19 Oct 2018,"Tesla sure loves shaking things up at weird times. Late in the evening on Thursday, Elon Musk decided to announce a new variant of Model 3 that costs less..."
New Tesla chairwoman Robyn Denholm's tallest order: Shareholders want a more 'boring' Musk,9 Nov 2018,"Tesla tapped Telstra CFO Robyn Denholm, already a Tesla independent board member, as its new chairman. Critics say she will be a rubber stamp for Musk;..."
"Tesla, GM, and Nissan Unite to Save Their EV Tax Credits",14 Nov 2018,"The EV Drive Coalition will push Congress to extend the $7500 federal tax credit for electric cars, but advocates say it could do much more."
Tesla CEO Elon Musk: The 2018 60 Minutes Interview,9 Dec 2018,"Tesla CEO Elon Musk: The 60 Minutes Interview ... Elon Musk, the CEO of the electric car company Tesla, has been called a genius, a visionary. But this year he..."
Porsche's biggest competitive advantage over Tesla,7 Dec 2018,"As it is doing now with its move into electric cars, Porsche is able to respond to demand cues because it has large factories in Stuttgart and Leipzig in..."
Tesla: Robyn Denholm named as new chair to replace Elon Musk,8 Nov 2018,"Tesla: Robyn Denholm named as new chair to replace Elon Musk ... Tesla has appointed Robyn Denholm as chair of its board, replacing the electric carmaker's..."
Tesla gives buyers days to order or potentially lose a $7k credit,12 Oct 2018,Tesla is giving buyers just a few days to order one of the company's new battery-electric vehicles and still be sure of receiving a federal tax credit of up...
"Corporate Governance Case Study: Tesla, Twitter, and the Good Weed",10 Dec 2018,"Corporate Governance Case Study: Tesla, Twitter, and the Good Weed · Musk must step down as chairman of the board and be replaced by an independent chairman,..."
Tesla's Navigate on Autopilot is like Waze on steroids,6 Nov 2018,It's the first time Tesla has grafted a layer of mapping data on to Autopilot. Navigate on Autopilot is like Waze on steroids. It offers all the step-by-step...
