Headlines,Dates,Descriptions
What Does The Tesla Model 3 Have In Common With A Cheap Toyota Etios?,01 Nov 2019,"“That depends on many test factors, but it usually has 100 μm. Thickness depends on what each carmaker sets as a resistance requirement for the product..."
"Tesla Model 3 Long Range AWD Gets 12 Miles More Range, Tiny Price Bump",01 Nov 2019,"Tesla Model 3 Long Range AWD: range up 4%, price up just 1% ... Tesla started November 2019 with a small change in the Tesla Model 3 offer in the U.S. as the Long..."
Tesla and Walmart settle lawsuit over issues concerning solar panel installations,05 Nov 2019,Tesla's lawsuit with American multinational retail giant Walmart has come to a close according to a joint statement made by the two companies.
Tesla Plaid Model S smashes unofficial lap record at Nürburgring by 10 seconds,05 Nov 2019,"Californian carmaker Tesla has been plugging away testing the ""Plaid"" Model S on German test track Nürburgring Nordschleife and has come away with new..."
Tesla Solar Roof tiles are now ready to hit the market,05 Nov 2019,Tesla's Solar Roof is one of the cleverest ideas in the solar panel market right now: instead of selling you bulky but efficient panels to install on your...
"The Cybertruck vs. F-150 comparison isn’t fair, Tesla tells California officials",13 Dec 2019,"One of Tesla's top executives explained the Cybertruck will enter production as a Class 2B truck, while the Ford F-150 falls into the 2A category;..."
Your Tesla could help you get cheaper insurance through data,13 Dec 2019,"A Tesla owner need only share their Tesla Account login credentials with the By Miles app, and the app will automatically read the car's mileage periodically."
"Tesla Cybertruck loved by non-truck owners, less so by truck owners, says survey",13 Dec 2019,"Tesla Cybertruck loved by non-truck owners, less so by truck owners, says survey ... The recently revealed Tesla Cybertruck is running neck-and-neck in popularity..."
"The Week in Tesla News: Holiday Updates, Stock Gets High(er), Cybertruck Competition and the Bionic Tesla Owne",24 Dec 2019,A holiday update from Tesla that provides a glimpse of the full self-driving feature the company is working toward tops our weekly look at Tesla news.
Tesla launches a new in-car music studio as Christmas gift,24 Dec 2019,"In addition to creating a visual masterpiece with the Tesla Sketchpad, you can now make audio masterpieces with TRAX. Simply add some instruments, adjust the..."
New Tesla Cybertruck Competitor Has 600 Horsepower,24 Dec 2019,The Lordstown Endurance electric pickup comes with 600 Tesla-fighting horsepower.
UPDATE: Car And Driver's Long-Term Tesla Model Had 3-Way Failure While Parked,31 Dec 2019,Car And Driver's long-term Tesla Model 3 was parked for a Christmas gathering when the Tesla app warned of a failure that would prevent it from running.
Feds Will Investigate Deadly Tesla Crash in Gardena,31 Dec 2019,Agency spokesman Sean Rushton wouldn't say whether the Tesla Model S was on Autopilot when it crashed on Dec. 29 in Gardena. That system is designed to...
What Lies Ahead For Tesla In 2020?,31 Dec 2019,"Tesla's vehicles already have enough range (and way more than enough performance) to satisfy most buyers, so any increase in battery capacity could translate to..."
NHTSA to probe fatal Tesla crash on I-70,09 Jan 2020,"NHTSA to probe fatal Tesla crash on I-70 ... Jenna Monet, 23, Prescott Valley, Ariz., died on Dec. 29 when the Tesla Model 3 in which she was riding crashed into..."
Fatal Indiana Tesla crash to be investigated by NHTSA,09 Jan 2020,"The National Highway Traffic Safety Administration will investigate a crash on Interstate 70 near Terre Haute, Indiana, that killed a 23-year-old."
Is Tesla Stock the Most Valuable Car Company in America Ever? Not Yet.,09 Jan 2020,"Using inflation data, a dollar at the end of 1955 is worth about $10 today , according to the Bureau of Labor Statistics. Prices, the way economists calculate..."
Sea of Clouds: supply of magnesium alloys to Tesla's first-tier suppliers | Shanghai Non ferrous Metals,10 Jan 2020,Yunhai Metal said it is currently supplying magnesium alloys to Tesla's first-tier suppliers and is also working to strengthen cooperation with Tesla in deep-...
"Tesla Track Mode V2 Release Notes: Third-Party Charging, Bluetooth update included",06 Mar 2020,"To access, press the lightning bolt icon on the bottom of your touchscreen, scroll down and select a Supercharger, Destination Charging or third-party charging..."
What Do The Body Shells Of Ford Mach-E And Tesla Model Y Tell Us?,06 Mar 2020,"The Mach-E body does not present any signs of revolutionary building methods. If we did not know it will be for an electric vehicle, it would look quite..."
I bought the cheapest Tesla Model X ever: $30000 electric SUV,06 Mar 2020,"I bought the cheapest Tesla Model X ever: $30,000 electric SUV ... I bought what is most likely the cheapest Tesla Model X ever – excluding salvaged vehicles..."
Tesla's Next Autopilot Feature? Traffic Light Recognition and Response (Sort Of),03 Apr 2020,"The system uses forward-facing cameras, GPS, and map data to detect traffic lights and stop signs. As the car approaches an intersection with Autopilot engaged,..."
Tesla Model Y’s front impact structure opens doors to a stellar safety rating,03 Apr 2020,The tusk is designed to collapse into the vehicle's longitudinals. This energy will then be transferred to the now-thicker front end rail in the event of a...
Tesla Model Y underbody shows zero compromises in safety and innovation,03 Apr 2020,Immediately noticeable from the Model Y's underbody was the flexible corrugated wrap Tesla used for the vehicle's 12V wires. Munro noted that the use of...
Mercedes-Benz to rival Tesla “Plaid” drivetrain with AMG flagship electric EQS,07 Apr 2020,"Another “official” source has also said that in line with Mercedes' 'Electric First' plans, an all-electric AMG drivetrain seeks to challenge the souped-up tri-..."
Mercedes-AMG Reportedly Doing a High-Performance EQS EV to Fight Tesla's Model S,07 Apr 2020,"Would you buy the electric AMG instead of the Tesla, or is that just ludicrous?"
Tesla Model Y Deep Dive Reveals A Much Better Engineered Car Than The Model 3,07 Apr 2020,"After looking at the Model Y and talking with Munro experts, I'm convinced that the Y is much improved from the Model 3 on which it is based. · The Rear Part Of..."
Here's How to Put A Bigger Motor Into A Tesla Model S 75D,22 Apr 2020,"How Do You Put a Bigger Motor in a Tesla Model S? For the conversion, Rich needed a donor vehicle for the parts. So, he picked up a Model S 100D at an auction..."
Tesla Cybertruck Will Be Smaller Than The Concept And Able To Float,22 Apr 2020,"Tesla Cybertruck will be smaller than the concept and able to float, says Elon Musk. Tesla CEO Elon Musk has shared more details about the electric carmaker's..."
Only Tesla Model X Owners Know About These Features,22 Apr 2020,"Tesla Model X owners know the secret to turn the car on, and it's actually rather simple. With the key in the car, simply press and hold on the brake pedal. The..."
Jrzy_M3P 2020 Tesla Model 3 Performance Build,03 Jun 2020,Hey everyone! I wanted to share with y'all the build of my Model 3. I have a more detailed journey of pictures on my IG: Jrzy_M3P so feel free to check...
"10 Biggest News Stories of the Week: Tesla Pricing Cuts in Front of Audi Q7, Acura TLX",03 Jun 2020,"No doubt at least some of those readers were disappointed to learn that, even after the $5,000 discount, the cheapest Model S and Model X would still cost them..."
"Real UFO History: Einstein, Tesla, Edison, and Marconi on Radio Signals from Aliens",03 Jun 2020,"Real UFO History: Einstein, Tesla, Edison, and Marconi on Radio Signals from Aliens. The Vast of Night features an alien radio signal mystery, not too..."
Tesla's Breakneck Rise Is Making Employees Rich,07 Jul 2020,"Elon Musk: chief executive billionaire. No one at Tesla is getting richer than CEO Elon Musk, who is deep into a rare entrepreneurial run. His latest disclosure..."
Tesla Solar Panels and Roof: Pricing and how to buy,07 Jul 2020,Tesla solar panel and solar roof: everything you need to know about pricing and availability of Tesla's solar products and more.
"Tesla Park should be open to Bay Area walkers, not vehicles",07 Jul 2020,The state parks department can re-designate Tesla as a non-motorized park and preserve. This decision would solve two problems at once: The department could end...
Is Tesla's share price surge an opportunity to sell?,08 Jul 2020,"That certainly applied to the brilliant Serbian-American electrical engineer Nikola Tesla, famous for his pioneering work on the alternating current (AC)..."
Tesla stock is a gigantic bubble on the verge of exploding: strategist,08 Jul 2020,"Tesla stock is a gigantic bubble on the verge of exploding: strategist ... The insane run in Tesla's stock (TSLA) could be at risk of being short-circuited soon,..."
Tesla Scores Another Victory in Virginia and Deals a Blow to Representational Standing,08 Jul 2020,"On March 3, 2020, the Virginia Court of Appeals ruled that the Virginia Automobile Dealer Association (VADA) lacked standing to appeal a determination by the..."
"Tesla's Patents, Einstein's Letters and an Enigma Machine Are Up for Auction",10 Jul 2020,"Tesla's Patents, Einstein's Letters and an Enigma Machine Are Up for Auction ... Famous scientists are often viewed only in the context of their work. But..."
Tesla and Nikola’s Race to the First Electric Pickup Truck Has a Hot New Rival,10 Jul 2020,"Amazon-backed EV startup Rivian could be the first company to deliver an electric pickup truck early 2021, far ahead of other competitors."
Elon Musk just surged past Warren Buffett on the list of the world’s richest people,10 Jul 2020,"After Tesla's stock (TSLA) jumped 11%, Elon Musk's net worth hit $70.5 billion and he passed Warren Buffett on the list of the world's richest people."
Autonomous cars: five reasons they still aren't on our roads,30 Jul 2020,"Elon Musk thinks his company Tesla will have fully autonomous cars ready by the end of 2020. “There are no fundamental challenges remaining,” he said..."
Panasonic To Boost Energy Density Of Batteries For Tesla By 20%,30 Jul 2020,"According to an exclusive Reuters' report, Panasonic aims to increase the energy density of lithium-ion batteries supplied for Tesla by 20% in 5 years."
Tesla Texas Gigafactory's Massive Size Shown In Scale Comparison,30 Jul 2020,"When Gigafactory Nevada was being constructed, it was planned to be the world's largest building. Now it appears Tesla Inc's (NASDAQ: TSLA) newest factory..."
Tesla Ditches Robots for World's Largest Casting Machine,15 Sep 2020,"Instead, molten aluminum will be injected into the Gigapress, molded, and removed by robots — effectively allowing Tesla to bypass the riveting and gluing that..."
VW comes after Tesla with detailed ID.4 and Model Y comparison,15 Sep 2020,"VW also points out that the ID.4 is 17 cm (6.6 inches) shorter than the Model Y and yet, they claim an extra 6 cm (2.3 inches) of interior space."
Tesla releases new software update enabling Autopilot to stay in passing lane if you want,15 Sep 2020,"“While Navigate on Autopilot is activated, your car can now remain in the passing lane. To adjust your passing lane preference, tap Controls > Autopilot >..."
Tesla Model 3’s 2020 sales are greater than the next five EVs combined,01 Oct 2020,"Tesla will make about 500,000 vehicles in 2020 but 2021 will see over 50% growth. It should be between 800,000 to 1,000,000 depending on how soon Berlin and..."
Is Tesla's Share Price Bonkers?,01 Oct 2020,"So, the stock price is not entirely crazy. But neither is it compelling. Morningstar's Tesla analyst, David Whiston, assigns the company's shares a fair value..."
Global EV sales: Tesla Model 3 outsells next five most popular electric cars combined,01 Oct 2020,Tesla has sold more Model 3 electric sedans worldwide in 2020 than the next five most popular all-electric cars combined.
Just How Much of a “Breakthrough” is Tesla's Tabless Battery Cell? - News,07 Oct 2020,"With the tabless design, the whole edge of the electrode is responsible for current (and heat) transfer. Heat transfer occurs through an area as large as the..."
Instant Tesla convertible,07 Oct 2020,A new Tesla Model Y is said to have lost its entire glass roof on its first journey after delivery – a short video of which has appeared on social media.
"Tesla Car Prices In 2020: How Much Model S, 3, X, & Y Cost",07 Oct 2020,"The standard model currently sits at a purchase price of $49,900, but even as a larger vehicle (room for seven with an additional $3,000 option) the Model Y..."
SpaceX 'Starman' zooms past Mars in Elon Musk's Tesla,09 Oct 2020,"SpaceX's mannequin, aptly dubbed ""Starman,"" whizzed past Mars on Musk's Tesla Roadster this past Wednesday."
"2021 Tesla Model S Rendering Gets the Light Touch Right, Probably Not Much Else",09 Oct 2020,"The Tesla Model S Plaid Musk confirmed during Battery Day is still over a year away, but will it bring any major design changes when it eventually launches?"
How Do Other Charging Networks Compare To Tesla Superchargers?,09 Oct 2020,"And Tesla has more speed too—the next-generation V3 Supercharger can deliver charging rates up to 250 kW, allowing drivers to add 75 miles of range in 5 minutes..."
Nio Stock Surge Tops 1000% as Tesla's China Nemesis Gains Speed,12 Nov 2020,"A year ago, Nio Inc.'s dwindling cash and sputtering sales had the electric-car upstart on the brink of doom. Fast forward, and the stock's 11-fold gain in..."
BMW Unveils Tesla Challenger Electric SUV iX,12 Nov 2020,"German automaker Bayerische Motoren Werke ADR (OTC: BMWYY) unveiled its electric SUV, the iX, on Wednesday. Reuters reported that BMW is planning a U.S...."
Tesla’s FSD Beta continues impressive operation with nighttime driving montage,12 Nov 2020,"And especially looking further into the Infrared part of the spectrum, to make traffic more ""visible"" at night. The system can only work with the information..."
I wanted a Tesla. Then I found out the company doesn't hire enough Black people,17 Dec 2020,"The lack of Black people on Tesla's staff isn't unusual in the tech world. The industry has long struggled with finding, hiring and promoting Black talent. But..."
Tesla To Source Nickel-Heavy NCMA Batteries From LG Chem Starting In 2021: Report,17 Dec 2020,"LG Energy Solutions, the electric vehicle battery business spun off from LG Chem, has embarked on making EV batteries from four different materials,..."
Tesla audio software partner collaborates with Bose for better cabin noise control tech,17 Dec 2020,"The collaboration gives Bose the opportunity to bring its QuietComfort Road Noise Control (RNC) technology to vehicles that support the Audio Weaver platform,..."
Tesla Model S Tourer Rendering Is All Kinds of Weird but You'll Like It Anyway,05 Jan 2021,"The Tesla Model S is in line for a refresh, so while we're waiting for the real thing, why not waste some time talking about this thing? It's called the ""Tesla..."
Tesla Model Y deliveries in China moved to Q2 2021 amid influx of orders,05 Jan 2021,It appears that the influx of orders for the Made-in-China Tesla Model Y is not abating anytime soon. Based on recent updates to Tesla China's online...
"Tesla charging stations coming to Haifa, Eilat, Be'er Sheva, and Tel Aviv | Ctech",05 Jan 2021,"The U.S. electric car manufacturer will be building charging stations for Tesla vehicles in Tel Aviv and Haifa, with ones coming to Eilat and Be'er Sheva..."
Tesla founder Elon Musk is now the world's richest human,07 Jan 2021,"Back in 2018, Elon Musk negotiated a controversial pay package (pdf). The Tesla CEO agreed to receive no salary or bonuses in exchange for a purely..."
Tesla chief Elon Musk passes Jeff Bezos to become world's richest person,07 Jan 2021,"Tesla chief Elon Musk has become the richest person in the world, with a net worth of more than $185bn."
Tesla Model 3 the UK's best-selling car overall in December 2020,07 Jan 2021,"In December 2020, PEVs made up 23.4% of the market share. And the Tesla Model 3 was the UK's best selling auto overall, at 5798 vehicles."
Tesla Model X with over 400000 miles gets turned into a piece of art by Kenny Scharf,18 Mar 2021,"Tesla Model X with over 400,000 miles gets turned into a piece of art by Kenny Scharf ... A Tesla Model X with over 400,000 miles, making it one of the highest..."
Electric car grant removed from most expensive models to end'Tesla subsidy',18 Mar 2021,"Electric cars costing more than £35000 are no longer eligible for the plug-in car grant, as the government takes aim at the wealthiest buyers of zero..."
Tesla to shut down final assembly plant in Tilburg following Model S/X refresh,18 Mar 2021,"Tesla to shut down final assembly plant in Tilburg following Model S/X refresh ... Tesla is shutting down its assembly plant in Tilburg, the Netherlands, where..."
Tesla Stock: Why ARK's Use Of Wright's Law Is So Wrong (NASDAQ:TSLA),26 Mar 2021,"Pioneered by Theodore Wright in 1936, Wright's Law provides a reliable framework for forecasting cost declines as a function of cumulative production."
"Tesla’s touchscreen-based gear selector for the new Model S is legal, confirms NHTSA",26 Mar 2021,"Tesla's touchscreen-based gear selector for the new Model S is legal, confirms NHTSA ... It appears that Tesla's touchscreen-based gear selector system for the..."
"Tesla Model 3 Vs VW ID.4 Road Trip: Range, Charging, Racing",26 Mar 2021,"With that said, the Volkswagen ID.4 has really impressed many EV fans. It makes the most sense to compare the ID.4 to the Model Y rather than the Model 3."
Tesla partners with TikTok to launch in-car video recording – UPDATE,01 Apr 2021,"Tesla has teamed up with social media giant TikTok to allow the owners of its electric cars to record, edit and upload viral videos directly from their vehicles..."
Check Out This New Account Of Tesla's Deepest Roots,01 Apr 2021,"Paul Carosa, who was AC Propulsion's VP of Engineering, told me that Fagan was the one who originated the idea to build the tzero. “They did their own version..."
Apple to buy over $50 million worth of batteries from Tesla for new energy storage project,01 Apr 2021,"Considering Tesla is estimated to charge between $200 and $300 per kWh for Megapacks, this is a significant project between the two companies since Apple is..."
Musk Claims Tesla Roadster SpaceX Will Do 0-60 MPH In 1.1 Seconds,21 May 2021,Elon Musk claims the Tesla Roadster will be able to hit 60 miles per hour in 1.1 seconds with the optional SpaceX rocket thruster package.
0 to 100 in 1.1 seconds? SpaceX package may make Tesla Roadster quickest ever,21 May 2021,Tesla Roadster in current form claims to hit 100 kmph in 1.9 seconds but cold air thrusters could make it even quicker.
UPDATE: Did Tesla Stop Taking Orders For Model S Plaid+?,21 May 2021,"***UPDATE: We've been informed that an mail from Tesla to its stores yesterday advised that Plaid+ is ""no longer an option for ordering,"" due to ""long lead..."
Tesla Model 3 spied testing in Pune ahead of India launch. Watch here,15 Jun 2021,Tesla Model 3 is expected to be the first officially launched vehicle in India from the US EV manufacturer..Tesla Model 3 is expected to be priced at around...
Tesla to take over Trafford Centre car park,15 Jun 2021,Tesla is to relocate its existing delivery hub at Manchester Airport to the Trafford Centre. The airport site is required for use as a car park once more as...
Elon Musk elaborates on Tesla's new electric motor,15 Jun 2021,"In a new series of tweets yesterday, the CEO elaborated on that machine: ""Fiber is wound over rotor at high tension load. Machine to do this was made by Tesla..."
Tesla Model S and Model X cop hefty price rises - carsales.com.au,11 Aug 2021,"Similarly, the 2022 Tesla Model X Long Range has incurred the same price increase and now starts at a $161,990 list price. It was previously listed at $149,990..."
"Turns Out You Can Trick All Driver-Assist Systems, Not Just Tesla's",11 Aug 2021,"A test by Car and Driver shows that all driver-assist systems can be tricked, albeit intentionally, showing the need for car brands to foolproof their..."
Tesla's vision-based Autopark: What it is and how it's better,11 Aug 2021,Tesla has now released an improved Autopark feature for the new Model S that relies on vision with update 2021.24.2. Previously Autopark relied heavily on the...
Tesla Model 3P Puts Up A Good Fight Against Porsche Taycan Turbo S,13 Aug 2021,Tesla Model 3 Performance vs. Porsche Taycan Turbo S drag race proves once again that the compact EV is almost as quick as the much more powerful luxury...
Tesla Model Y electric SUVs spotted in Europe with odd 'Not Model Y' decal,13 Aug 2021,Tesla Model Y electric SUVs spotted in Europe with odd 'Not Model Y' decal ... A bunch of Tesla Model Y electric SUVs have been spotted in Europe sporting odd “...
Tesla Re-Enables Supercharging For Salvaged Vehicles,13 Aug 2021,"In an attempt to discourage people from buying salvaged Tesla models, repairing them, and returning them back to the roads, Tesla disabled all Supercharging..."
Tesla starts hiring roboticists for its 'Tesla Bot' humanoid robot project,25 Aug 2021,"“Tesla's actuator team designs and builds actuators for humanoid bi-pedal robots (Tesla Bot). The team joins mechanical, electrical, and electromagnetic..."
Tesla Energy and its Autobidder software are making power companies nervous,25 Aug 2021,Autobidder is AI software that creates communication between all the systems(households and commercial) that's on Tesla's network and can automatically direct...
"Lucid Air EV drove 445 miles on a charge, besting Tesla",25 Aug 2021,The Tesla Model S has an EPA-estimated range of 405 miles. Lucid claims the Air can go up to 517 miles on a full battery.
Tesla ordered to pay nearly $137M to Black former worker who claimed racial abuse,05 Oct 2021,Tesla Inc. must pay nearly $137 million to a Black former worker who said he suffered racial abuse at the electric carmaker's San Francisco Bay Area...
Tesla must pay $137 million in discrimination lawsuit,05 Oct 2021,Tesla has been ordered to pay $137 million in damages to a former Black worker who accused the company of ignoring discrimination and racial abuse.
Tesla told to pay $137M to ex-worker who said he faced racist abuse,05 Oct 2021,"Owen Diaz, who contracted at Tesla's Fremont, California, factory as an elevator operator, said colleagues told him to ""go back to Africa,"" per CNBC."
"Tesla's Spending on R&D and Marketing, Compared to Other Automakers",11 Oct 2021,"How much does Tesla spend on a per car basis on innovation and marketing, compared to more traditional automakers?"
Tesla Auto Insurance Expanding into Texas This Week,11 Oct 2021,"Redpoint will underwrite Tesla's Texas insurance program, which will be distributed through the Tesla Insurance Services of Texas Inc. (Tesla), an MGA formerly..."
"Tesla took 12 years to build 100,000 cars. China's Xpeng and Nio took about half that time",11 Oct 2021,"Tesla took 12 years to build 100,000 cars. China's Xpeng and Nio took about half that time · U.S.-listed start-up Xpeng said Monday it has produced 100,000 cars..."
"Tesla (TSLA) breaks record in China, resulting in massive delivery expectation beat",12 Oct 2021,"When Tesla announced that it delivered a new record of 241,300 electric cars last quarter, 20,000 more than analysts were expecting, it was clear that great..."
Tesla invites more drivers to ‘Full Self-Driving Beta’ program — read the email here,12 Oct 2021,"To get access to the FSD Beta program, drivers must own Tesla vehicles with newer hardware, and must purchase or subscribe to the premium FSD package, which..."
Watch A Professional Car Detailer Explain How Teslas Are Poorly Built,12 Oct 2021,"From inconsistent build quality to skimping on the paint job, the video points out various instances that call the quality assurance of Tesla into question."
Why do people have such an unreasonable hatred towards Teslas on the road?,15 Oct 2021,"When you key a car, you're not righting a wrong, you're acting out your own self-loathing. You're taking your own flaws and insecurities out on an inanimate..."
Tesla No Longer Shows Prices for the Cybertruck on Its Website,15 Oct 2021,"Tesla No Longer Shows Prices for the Cybertruck on Its Website ... Tesla recently increased the prices for the Model 3 and Model Y in the U.S. by up to $2,000."
First drive: Tesla's new Model Y crossover can see off its challengers,15 Oct 2021,"Coming in at €70000, it is at the top end of the price range for these mid-sized crossovers."
Volkswagen CEO demands 'revolution' to tackle Tesla,04 Nov 2021,"Volkswagen CEO Herbert Diess told employees at the German carmaker on Thursday to prepare for the ""revolution"" needed to take on electric car pioneer Tesla..."
Tesla's Breakneck Rally Opens Biggest-Ever Chasm With Analysts,04 Nov 2021,The breathless rally in Tesla Inc. has now created the stock's biggest-ever spread over Wall Street analysts' average price target for the shares.
"Hertz Will Have to Wait for Teslas, Just Like Other Buyers - WSJ",04 Nov 2021,"Hertz on Oct. 25 said it had placed “an initial order of 100,000 Teslas by the end of 2022.” The press release included no statement from Tesla and Tesla Chief..."
Tesla (TSLA) Stumps US Regulators With Over-the-Air Software Updates,05 Nov 2021,"In September, Tesla beamed an over-the-air software update to its vehicles aimed at improving how its driver-assistance system Autopilot identifies stopped..."
