Headlines,Dates,Descriptions
VW Makes Big Bet on EVs,20 Jul 2010,"Volkswagen is diving into electric vehicles with the goal of selling 300000 annually by 2018, and it has tapped an early pioneer of the modern EV to help..."
"BREAKING: Honda Plans Electric Car, Plug-in Hybrid For 2012",20 Jul 2010,"Just like last week's Toyota-Tesla announcement, the rumor mill went into overdrive yesterday with talk of plans from Honda to build both electric cars and..."
Glenn Beck Going Blind Macular Degeneration - What Is Macular Degeneration Blindness?,20 Jul 2010,Conservative talk-show host Glenn Beck recently announced he has been diagnosed with a condition that may make him blind. But there are more than 100...
IndyCar's new chassis: Plenty of questions remain,22 Jul 2010,Some questions about the 2012 Izod IndyCar Series chassis program chosen recently by a dedicated committee:-- What are the rules?-- How much are repla.
Lincoln Kills the 'Hybrid Premium',22 Jul 2010,"One big gripe people have about hybrids is they cost a few grand more than similar conventional models. It's the so-called hybrid premium, and critics say..."
White Zombie Electric Race Car Does 0 to 60 mph in 3 seconds,22 Jul 2010,"In order to set a new round of record-breaking electrical hot-rodding at Portland International Raceway, the drag racer John Wayland has converted an old..."
Nvidia chip team gets 25 million dollars from US military,10 Aug 2010,Nvidia on Monday said it is leading a team awarded 25 million dollars by Defense Advanced Research Projects Agency (DARPA) to create a chip that leaves...
GM aplies for Patent on Opel Insignia OPC in China,10 Aug 2010,"GM applied for patent on the Opel Insignia OPC in China. Note the missing logo, they won't sell it branded as 'Opel'. The Insignia is made in China by."
Ford F-150 News: 2011 Harley-Davidson F-150 Revealed –,10 Aug 2010,"The branding alliance between Ford and Harley-Davidson—barring Lee Greenwood marrying a bald eagle, possibly the most American alliance in history—has..."
IPL: Infiniti spells performance with new custom line to debut on G coupe,11 Aug 2010,"Time will tell whether the IPL brand will carry the gravitas of Mercedes-Benz AMG or BMW M. But for now, it spells 18 hp and a host of sporty cosmetic."
Long Term Update 2: 2010 Buick LaCrosse,12 Aug 2010,"""I relied heavily on the cruise control while driving to and from Mojave last week,"" notes assistant Web producer Carlos Lago, ""but found our LaCrosse..."
Tesla Roadster Confirmed For GT5,16 Aug 2010,The Tesla Motors Facebook page has confirmed that their battery powered electric sports car will feature in Polyphony's Gran Turismo 5.
Lamborghini V10 in the S6,16 Aug 2010,"Yes, you read that title correctly. The V10 engine in the engine bay of the S6 is similar to that in the Gallardo. Since both brands are owned by Volkswagen..."
A first look at the Coda electric sedan,18 Aug 2010,Coda's self-titled debut sedan is small in statue but carries ambitious goals for the upstart California electric-car maker.The five-passenger ride is.
Sandra Bullock Gives Ex Jesse James Texas-Sized Welcome To Austin,18 Aug 2010,"Sandra Bullock doesn't mind that her serial cheating ex hubby Jesse James is moving to her hometown of Austin, Texas, RadarOnline.com has learned."
Biogas.se enters a third Volkswagen Scirocco,24 Aug 2010,Johan Kristoffersson is going to drive the older specification Volkswagen Scirocco that was replaced for the STCC race at Falkenberg by the newer S2000...
Silent Toyota Prius to get sound generator,25 Aug 2010,"The Toyota Prius is about to get an optional speaker system designed to alert pedestrians that the car, which can run near silently, is on the move."
BMW of North America president to host Teen Driving School,25 Aug 2010,"Students and teens living in Evans, Ill., will have the opportunity to attend a special driving seminar at U.S. Cellular Field in Chicago on Sept. 7."
Toyota Rerates Tundra Towing Capacity Under New SAE Guidelines,25 Aug 2010,"Toyota has become one of the first automakers to test and certify a truck against the Society of Automotive Engineers' new unified towing standard, reports."
True Bliss Customs Matte Black BMW E92 M3 Photoshoot,27 Aug 2010,"First of all, let me say that this is probably the best matte black BMW E92 M3 out there! On of the sickest jobs that we saw! The people working over at..."
"CAFE Putting Pressure on Nissan, May Drop Rugged Xterra",27 Aug 2010,"We liked it enough to name it our 2005 Sport-Utility of the Year, but rising Corporate Average Fuel Economy (CAFE) pressure and slow sales may prompt Nissan..."
PC World and Currys Offer Old Computer Trade-In,27 Aug 2010,"PC World and Currys are offering cash for old working laptops, desktops, and Macs as part of a six day trade-in scheme. With parents potentially gearing up..."
Spartan Gladiator Classic Displayed at IAFC,30 Aug 2010,The Association of Fire Chiefs (IAFC) Fire-Rescue International Conference held in Chicago last week was the venue of choice for Spartan Motors to showcase...
EXCLUSIVE: Farrah Fawcett's Father Dies; Grandson Redmond O'Neal Attends Funeral,30 Aug 2010,"Farrah Fawcett's elderly father has died, RadarOnline.com has learned. [ami-related target=""_blank"" url=""https://www.radaronline.com/photos/image/1892""..."
Strand-Craft 122: It's a boat and a car,01 Sep 2010,"Feel like boating this holiday weekend? Here's what every AutoWeek reader needs: Mega-yacht builder Strand-Craft has introduced its extravagant 122, w."
Sofia Vergara's TwitPic of Boyfriend in the Hospital,01 Sep 2010,"Sexiest patient ever? Sofia Vergara gushes about her hospitalized boyfriend, posting a TwitPic to prove that not even surgery after a serious car accident..."
Falken High Country All Terrain Tire,01 Sep 2010,"When we set out looking for a tire for our own use, we usually come up with one that's tried and true, or one that's so full-on new that most people haven't..."
Epic Electric Vehicles Unveils New Torq Roadster,02 Sep 2010,"Epic Electric Vehicles is a little known company based in the U.S. that manufactures all sorts of electric modes of transport including boats,..."
Track Layout for Austin F1 Circuit Unveiled,02 Sep 2010,"The designers from Tilke GmbH have unveiled their design for the new Formula 1 racetrack set to be built near Austin, Texas. The location is scheduled to..."
McLaren MP4-12C preview - Drive,09 Sep 2010,"On the other side of the ledger, there are those cars that seem on the bland side when captured in photos, but make a far better impression in person."
2011 BMW M3 Adds Standard M Drive,09 Sep 2010,"Attention M3 fans: Do you want a car with all the adjustable chassis settings but without that pesky and expensive iDrive? Well, we've got good news,..."
Eurobike 2010: New Reed and Alva mountain bikes from Bionicon,09 Sep 2010,"German company Bionicon were showing off their 2011 bikes at this year's Eurobike trade show, which included the 140mm-travel Reed and 160-180mm Alva."
NVIDIA Debuts Parallel Nsight 1.5 And CUDA Toolkit 3.2,14 Sep 2010,"CUDA. Performance increases. GPUs. NVIDIA. Tesla Compute Cluster. Somehow or another, all of those are interconnected in NVIDIA's latest announcement,..."
NVIDIA Announces Parallel Nsight 1.5 & CUDA Toolkit 3.2,14 Sep 2010,"Not to be outdone by Intel's IDF and AMD's counter-meeting this week, NVIDIA's GPU Computing group has their own announcement this week ahead of their GPU..."
The birth of Hurricane Julia,14 Sep 2010,"Hurricane Igor, headed towards Bermuda, is a category four storm with winds reaching in excess of 217kph [EPA]. In the middle of the Atlantic,..."
X-Prize winner E-Tracer powered by AC Propulsion electric-drive system,16 Sep 2010,"California-based AC Propulsion, the company known for providing drive system technology for the Tesla Roadster, Mini E, and eBox electric vehicles,..."
"BREAKING: Aptera Loses Automotive X-Prize, Li-Ion Motors Triumphant",16 Sep 2010,"For the past few years, small and medium-sized automakers have looked towards the prestige of winning the Progressive Insurance Auto-X Prize. for the..."
The new Toyota RAV4 EV to be unveiled at LA,16 Sep 2010,"Tuesday, Toyota USA announced on its Twitter page that the next generation of RAV EVs will be unveiled at the Los Angeles show, set to begin on November 19."
10Best Surprise: The S60 is a Red-Meat Volvo,20 Sep 2010,"We spent last week driving 60-plus new cars in order to decide our 2011 10Best list. When that many cars are gathered in one place, many of which we haven't..."
SETI 2060: Do we make contact by then?,20 Sep 2010,This month the National Radio Astronomy Observatory's Green Bank Science Center is celebrating the 50th anniversary of the modern day search for...
Ford dropping Ranger pickup from U.S. lineup after 2011,20 Sep 2010,"Ford Motor Co., as expected, is dropping the venerable Ranger compact pickup from its U.S. lineup after the 2011 model year.Ford is consolidating its."
Turbine Engines and Hybrid Cars - Jaguar Hybrid Electric Cars,30 Sep 2010,Jaguar's new concept hybrid-electric poses the question: Are turbine-powered backup generators the best way to run a gas- and electric-vehicle?
Newly discovered planet ‘habitable’,30 Sep 2010,Scientists describe conditions on Earth-like planet orbiting nearby star as “just right” for life to develop.
From Nickel Metal Hydride To Lithium Ion: Understanding Batteries,30 Sep 2010,What kind of batteries are in a Prius? Why are they different than the ones in the Tesla Roadster? Why is Honda changing the kind of batteries in its hybrid...
So what's the Maruti Suzuki EECO charge and SX4 hybrid all about?,11 Oct 2010,"India's largest auto manufacturer, Maruti-Suzuki has developed two hybrid vehicles - EECO Charge and SX4 Hybrid in India."
Chevrolet Volt Hybrid Drive System - General Motors Volt Powertrain,12 Oct 2010,General Motors has finally revealed the inner workings of the Volt's powertrain. Here are the details.
Hungary takes over red sludge firm,12 Oct 2010,"Zoltan Bakonyi, managing director of MAL, was detained for questioning in the country's worst-ever toxic spill [AFP]..."
French Website Makes Euro-Carpooling A Snap,12 Oct 2010,"PARIS — Carpooling websites are experiencing a boom in popularity in Europe as commuters, fed up with rail strikes and as concerned about their pocketbooks..."
Computer Aid Solar Cyber Café Goes Live In Kenya,15 Oct 2010,Computer Aid has today officially launched its first solar powered Internet café in Kenya enabling rural communities with no electricity to get online.
Swiss finish world’s longest tunnel,15 Oct 2010,Tunnel through the Alps is hailed as an environmental triumph as it will shift freight traffic from road to rail.
"Cause of Heidi Montag's Plastic Surgeon's Crash, Report",20 Oct 2010,"Officials say Dr. Frank Ryan's Jeep drifted off the highway with ""no evidence of any other contributing factors"""
Oldest Porsches in America,20 Oct 2010,"This 1952 Porsche 356 Cabriolet, owned by Robert Wilson, was imported into the United States in November 1952. 2. This 1950 Porsche 356 Cabriolet is from..."
Lane Keeping Assist Systems Explained,20 Oct 2010,"One of the best active safety features introduced on vehicles in the last decade or so is often overlooked, despite having saved countless of lives."
Next gen Roewe 750 to be Based on Buick Regal,21 Oct 2010,The next generation Roewe 750 will be based on the platform of the China-made Buick Regal. The Ragal is made by the Shanghai-GM joint venture. Shanghai.
PMC's Fact 3,21 Oct 2010,I was impressed by the looks and sound of PMC's new Fact 3 monitor ($9500/pair). PMC's Ian Verdugo explained that the company gave the model the “deluxe...
"2011 Chevrolet Volt (Chevy) Review, Ratings, Specs, Prices, and Photos",21 Oct 2010,"The 2011 Chevrolet Volt is an electric car, but drive as far as you want without worry—you won't have to make concessions for the technology onboard."
Gallery: Let Your Children Play With Robots,26 Oct 2010,"Robots can help children become smarter and happier. Javier Movellan, who has spent the better part of the last three decades playing with kids and robots,..."
2008 Dodge Ram 3500: Air-Ride Equipped,01 Nov 2010,"Tow, show, and lots of go- all in one."
2004 Ford F350 Super Duty - Tow Pig,01 Nov 2010,"If you're going to represent First Coast Diesel Performance the way Adam Brannan does, then you're just going to have to drive something special."
Brian Barker: 1993 Ford Ranger,01 Nov 2010,"The Danger Ranger If ever there was a TTC vehicle where engine performance ensured top status, Brian Barker's full-bodied Ford Ranger would be it."
Morgan Threewheeler returns after 58-year break,02 Nov 2010,"The Morgan Motor Co. will relaunch the Morgan Threewheeler after a 58-year hiatus, the British automaker said on Wednesday.The 2011 Morgan Threewheele."
Is This 170 MPH All-American Electric Supercar for Real?,02 Nov 2010,"A startup touts its entirely homemade, lightning-fast, lithium-ion-powered luxury two-seater. Watch out, Elon Musk, it's gunning for your Tesla Roadster."
Toyota Readies Ractis,23 Nov 2010,"Toyota launched the second generation of its Ractis subcompact in Japan. Never heard of a Ractis? No wonder: The first generation Ractis, introduced in 2005..."
Video: Rapper 50 Cent Uses Lamborghini as Bank Vault,23 Nov 2010,"The wealthy and super-wealthy of the world are very different from your Average Joe. For one thing, they often enjoy prestige banking services with..."
Chevrolet unveils the Camaro convertible at the 2010 LA Auto Show,23 Nov 2010,"The 2011 Chevrolet Volt is set to hit showrooms in the next month and at the 2010 LA Auto Show, there were plenty of Volt-related displays to bring..."
Tesla takes electric cars closer to pro racing,30 Nov 2010,"During practice sessions at the Race of Champions, professional drivers race the Tesla Roadster."
FLASH: the king of VUV and soft X-rays – CERN Courier,30 Nov 2010,"The FLASH free-electron laser at DESY is the first user facility to deliver, over the past five years, short and intense light pulses in the vacuum..."
"Out of Africa: Where Electric Vehicle Batteries Come From, Part II",30 Nov 2010,Does anyone care if their EV or laptop purchase helps pay for murder and environmental ruin in Africa?
"Bernie Madoff's Wife Blames Him For Son's Suicide, Author Says",13 Dec 2010,"Ruth Madoff, wife of Bernie Madoff, believes her son Mark ""would not have died if it weren't for what [Bernie] had done,"" a friend of the embattled family..."
Honda Civic GX update: A month of natural gas,14 Dec 2010,This is the latest in a series of updates on life with several different alternative-fuel vehicles.I have now gone almost 1500 miles on natural gas i.
"Lyndon Rive, Elon Musk: Cousins, partners - Silicon Valley Business Journal",28 Dec 2010,"It was probably just a matter of time before Lyndon Rive connected with his cousin Elon Musk, CEO of Tesla Motors Co. After all, their mothers were tw ..."
2012 Ford Focus To Become Part Of Company Custom Graphics Program,30 Dec 2010,"The 2012 Ford Focus has a lot to offer consumers like the torque vectoring control we wrote about yesterday. However, Ford isn't just offering functional..."
Recall Alert: 2008-2011 Dodge Ram and Ram 4500/5500 and Sterling Bullet,30 Dec 2010,"Chrysler is recalling 22274 Sterling Bullet, Dodge Ram and Ram 4500 AND 5500 chassis cabs from the 2008-11 model years to fix a problem with steering..."
NHTSA announces 2011 Ford and Lincoln recall over fire risk,30 Dec 2010,Ford Motor Company and the National Highway Traffic Safety Administration have announced a recall of a variety of 2011 Ford and Lincoln trucks and...
Leaked pics of purported Nintendo 3DS hit Web,03 Jan 2011,Several images reporting to feature the Nintendo 3DS have been leaked onto the Web. The device features a black finish and includes a thumbstick.
"If You Didn't Like Hot Rods Before, This Video Will Make You Convert",03 Jan 2011,"If you have yet to see a badass hotrod doing some awesome drifting, then look no further than this insane 1929 Ford. This menacing custom rod took part in..."
Mercury rolls into history with build of final Grand Marquis,03 Jan 2011,"The last Mercury--a Grand Marquis--rolled off the production line Tuesday at Ford Motor Co.'s assembly plant in St. Thomas, Ontario, marking the offic."
2010 Ford Fusion Part of Preliminary Investigation by NHTSA for Wheel Studs,26 Jan 2011,Ford's popular Fusion midsize sedan is part of a preliminary investigation by the National Highway Traffic Safety Administration. Following four complaints...
Rear-Drive Lambo Gallardos for All! New Base Monocolore Model Starts at $193895,28 Jan 2011,"Lamborghini has confirmed to us that the U.S. Gallardo lineup is growing. In addition to the LP550-2 Bicolore we told you about earlier in the week,..."
Gumpert to unveil the new Tornante at Geneva Motor show,28 Jan 2011,Gumpert has announced that they will introduce the second vehicle in their lineup when the new Tornante debuts in March at the 2011 Geneva Motor Show.
Tesla teams with Umicore to recycle battery packs in Europe,31 Jan 2011,"At the end of their long life, Tesla will recycle its battery packs at Umicore's UHT facility in Belgium. The Brussels-based materials technology company will..."
Renault Wants Consumer Tech Influence In Car Interiors,31 Jan 2011,"Designing an effective car interior isn't easy. Car companies need to think about the design, the features, and the ergonomics. After all, you spend more..."
Humanity's Endless Quest to Invent a Death Ray: A History,02 Feb 2011,"by Becky Ferreira. What if I said the Death Star's most deadly feature — yes, the one that rebel leader Admiral Ackbar said was “not yet operational” — was..."
BMW and Peugeot/Citroen Venturing for Future European Hybrid and Electric Cars,02 Feb 2011,"Few times in history have there been alliances between French and German auto manufacturers, but it seems right now that BMW and Peugeot/Citroen are..."
Japan rally highlights island row,07 Feb 2011,"Naoto Kan, Japan's prime minister, has called for Russia to return four disputed islands, held by Russia since the end of World War Two, prompting an angry..."
Recall: Suzuki's Grand Vitara Four-cylinder Engines Could Contain a Defective Tensioner Spring,07 Feb 2011,Suzuki issues a recall on 2009-2011 Suzuki Grand Vitaras with four-cylinder engines due to a defective accessory belt tensioner pulley that can cause...
Nissan Rolls Out an Electric Z Concept,09 Feb 2011,"When we first saw a production-ready version of the very impressive Nissan Leaf two years ago, we asked the brass, “Great. When do we see an electric Z?”..."
Mitsubishi to Spotlight Guinness World Records Broken by Outlanders in New Ad Campaign,09 Feb 2011,"Mitsubishi is out to prove the Outlander and Outlander Sport crossovers have some real SUV capabilities. Recently, the automaker took one of each Outlanders..."
Electric BMW 1-series ActiveE revealed,09 Feb 2011,"Along with the Vision ConnectedDrive concept, BMW will also unveil a production version of the all-electric 1-series ActiveE at the upcoming Geneva mo."
Thomas Edison Invention Collage Google Logo,11 Feb 2011,Google has a special logo for Thomas Edison's 164th birthday today. The logo represents a montage of his inventions over the years. It is also animated.
Netflix not into ads,11 Feb 2011,"Netflix may have thought about it, but the company won't be bringing ads to its streaming service. Speaking to Fast Company in an interview posted today,..."
Pagani Zonda F Driver Survives 199mph – 320 km/h Crash After Spinning Out of Control,18 Feb 2011,There are very few (if any) people that can lose control of their car at 199mph or 320km/h and live another day to tell the tale. But that's exactly what.
Special Needs Student Says Professor Discriminated Against Her,18 Feb 2011,The classroom conduct of a Broward College professor is in question following an incident in an anatomy class on the school's south campus last week.
Storm season picking up,18 Feb 2011,"Australia's Cyclone season, and that of the Southwest Indian Ocean, have taken a turn for the worse."
Cribbing From Headphones To Crank Up MPG,23 Feb 2011,The quest for better fuel economy has General Motors cribbing from headphone technology. The boost the efficiency of the GMC Terrain crossover utility...
George Barris Shows Car Warriors Who's Boss,23 Feb 2011,"A group of gearheads turning wrenches and firing up acetylene torches is about as ubiquitous on TV as a teary-eyed John Boehner, but the upcoming Car..."
Hopes fade for NZ quake victims,23 Feb 2011,PM says number of people killed in quake likely to go up as there is little sign of survivors emerging from the rubble.
Mazda Hosts European Ice-Racing Event for MX-5 Miata,24 Feb 2011,"This week, Mazda staged a unique—and totally awesome—race in in Åre, Sweden, that involved Miatas on ice. The four-hour race featured 20 of the roadsters,..."
Sony dropping PSP price to $129,25 Feb 2011,"The PlayStation Portable will be $40 cheaper and cost the same as the Nintendo DS Lite, which dominates the portable-gaming market."
Space shuttle discovery takes off,25 Feb 2011,"The flight will be the last for Discovery, the first of three shuttles NASA plans to retire this year [Reuters]. Space shuttle discovery, NASA's most..."
Teased Maserati GranCabrio Sport,25 Feb 2011,It's official. There is a new Maserati GranTurismo coming out and it'll be shown off at the 2011 Geneva Motor Show. The new vehicle is called the GranCabrio...
Report: Steve Jobs came close to knighthood,01 Mar 2011,"The U.K.'s Telegraph reports that Apple's white knight had the chance to officially add a new title to his name: sir. But in 2009, he apparently lanced his..."
"Saab PhoeniX Hybrid Concept, Its First, At 2011 Geneva Motor Show",01 Mar 2011,Saab has confirmed its commitment to introduce a hybrid vehicle with the unveiling today of the striking 2011 Saab PhoeniX concept car at the 2011 Geneva...
Spied! 2012 Chevrolet Malibu Caught Testing in Europe,14 Mar 2011,"Photos of what is believed to be the 2012 Chevrolet Malibu were just taken by our spy shooters in Europe, while the vehicle was being tested."
Questions remain in officer's death 10 years later,14 Mar 2011,"Ten years ago today, Aliquippa police officer James Naim was on a regular evening foot patrol in the Linmar Terrace housing project when he was ambushed..."
Preview: Panic! at the Disco Plot Spring Tour,14 Mar 2011,"With a comeback album Vices & Virtues due out March 22, Panic! at the Disco have announced a 28-date Spring tour, marking the first time remaining."
"Chevrolet Camaro renamed Ke Mei Luo for China - Mar. 22, 2011",22 Mar 2011,When General Motors unveils the Chevrolet Camaro for Chinese customers at the Shanghai Auto Show next month it will have a new Chinese name: Ke Mei Luo.
NHTSA Issues New Child Seat Guidelines,22 Mar 2011,"The National Highway Traffic Safety Administration, with input from the American Academy of Pediatrics, has revised its child restraint guidelines."
2014 Infiniti Electric Sedan – Feature –,22 Mar 2011,"What it is: A sleek luxury sedan designed as a dedicated EV. Why it matters: If EVs become a success, Infiniti will—for the first time—be a leader."
2012 Tesla Model S Prototype Workshop: Photo Gallery,01 Apr 2011,Some of the loudest of the skepticism over Tesla's plans to design and build an all-electric luxury sports sedan have died down after the company showed an...
Induction motors: The Difference Engine: Nikola's revenge,01 Apr 2011,"ONCE again, worrywarts in Washington are wringing their hands over possible shortages of so-called “critical materials” for America's high-tech industries."
The Coolest BMW You Can't Buy Has a Bed,01 Apr 2011,"The boys in Bavaria have built an M3 that hauls ass — and half a ton of stuff. This slick one-off is based on the BMW M3 convertible, which is stiff enough..."
Heated Car Seats Could Pose Burn Danger,07 Apr 2011,"Burn specialists, a safety group and NHTSA are investigating this issue. Some problems stem from heated seats used by people who lack feeling in their lower..."
Easter Jeep Safari returns to Moab,07 Apr 2011,"Thousands of Jeep fans will hit the desert later this month for the Easter Jeep Safari in Moab, Utah. They will be joined by six new customized vehicl."
The car that Alfa should have built,07 Apr 2011,"After nearly a decade of rumors about its existence, the world finally got to see a car that Alfa Romeo really should have built: the cabriolet versio."
Leaked Renault Electric Car Technology Scandal Fires COO Patrick Pelata,11 Apr 2011,"Patrick Pelata, Renault's Chief Operating Officer, has offered his resignation from the company that stands at the forefront of mass-produced electric..."
‘The future is now’: Bay Area car dealer proves electric cars can still be fun,11 Apr 2011,"If you ask Judy Mitchell-Rice to tell you the most impressive aspect of her Tesla Roadster Sport, it isn't the zero to 60 mph in 3.7 seconds, the 14000 rpm..."
Threats to Antarctica’s penguins heat up,12 Apr 2011,"There is a strong connection between climate change and penguin populations, as a warming planet causes declines in krill, a key food source for the birds..."
Nissan Leaf electric car • The Register,12 Apr 2011,"Regenerative braking puts power back into the system, but this isn't going to extend the range significantly. Nor will the Leaf's wee fir tree graphic on..."
Callaway Pumps Up 2011 Chevrolet Silverado to 540 Horsepower,12 Apr 2011,"Miss the street performance of the Ford F-150 SVT Lightning or Dodge Ram SRT10? Fear not, Callaway now has your answer in the form of the Callaway Silverado..."
Southampton rapist Derry Gilfoy trapped by DNA after attack,18 Apr 2011,POLICE overheard a prostitute pleading with a drunken punter not to harm her after she had dialled 999.
