Headlines,Dates,Descriptions
2014 CLA domination will help Mercedes-Benz overtake BMW,09 Dec 2013,The all-new 2014 Mercedes-Benz CLA-Class is selling better than expected and the four-door coupe will help Mercedes pass BMW in the U.S..
Billionaire Elon Musk's Mom Is An Incredibly Glamorous Working Model,24 Dec 2013,You know about Elon Musk's two companies: electric car-maker Tesla and rocket-launcher SpaceX. Advertisement. But do you know about his mom?
GIC buys 50 per cent stake in London office complex,24 Dec 2013,SINGAPORE: One of Singapore's sovereign wealth funds confirmed Tuesday it had acquired a 50 per cent stake in a major City of London office complex from...
Lexus RC Comes with Exclusive Red Paint Job,24 Dec 2013,"Having been unveiled at the Tokyo Motor Show, Lexus is ready to introduce its all-new coupe to the US at next month's Detroit Motor Show alongside the RC F..."
"North Carolina Toyota Avalon hits 500,000 miles!",09 Jan 2014,"If you're a fan of the new Toyota Avalon in N Charlotte, get ready – we've got some pretty exciting news about this incredible sedan!"
Lamborghini Veneno Roadster Sports 750-Watt Monster Audio System at CES,09 Jan 2014,"With a 750-hp 6.5-liter V-12 and a top speed of 221 mph, theLamborghini Veneno Roadstermakes its own music. But how does an audio enthusiast enjoy music in..."
Video: Top Gear's footage of a train smashing into a car is terrifying,09 Jan 2014,"Some people think that it's okay to sneak through a level crossing if they don't see a train coming, but those people often forget just how fast a train can..."
Tesla Direct Sales Remain Barred in Arizona,15 Apr 2014,Tesla will remain barred from selling its electric vehicles directly to consumers in Arizona after a bill that would have approved the sales model was...
NCE to Chop the Roofs Off 100 Tesla Model S Vehicles,15 Apr 2014,But now it stepped up its game considerably with the topless version of Tesla's Model S electric sports saloon. Although the tuning firm's been developing...
Simon Cowell takes leisurely afternoon drive with friend in silver Tesla electric car,15 Apr 2014,Simon Cowell was keen to help a friend take in the sights of sunny Los Angeles from the comfort of his silver Tesla car.
2014 Mercedes-Benz B-class Electric Drive – Review – Car and Driver,06 May 2014,"Benz builds a boring, useful EV wagon for suburbanites. Read more and see photos at Car and Driver."
Elon Musk On HBO's Silicon Valley,06 May 2014,"At TechCrunch Disrupt, HBO's Silicon Valley actor T.J. Miller shared a story with TechCrunch founder Michael Arrington about the time he ran into Tesla..."
"Mercedes' New EV Ain't Pretty, But It's Practical and Luxurious",06 May 2014,"Mercedes-Benz is no stranger to electrification, having already wowed us with the 740-horsepower SLS. But as impressive as that car is, the astronomical..."
"2014 Tesla Model S To Start At AU$95,000",23 May 2014,"Tesla will reportedly price the Model S sports sedan from $95,000, with official prices expected to be released in the coming days."
The Non-Billionaire's St. Barth: Rental Villas That Won't Break The Bank,23 May 2014,St.Barth is a playground of the rich and resort prices reflect that. The big secret: The island has a good stock of modest rental villas that won't break...
The Bay Area's Highest Property Tax Payers; Tesla Charging Station; More!,23 May 2014,Share All sharing options for: The Bay Area's Highest Property Tax Payers; Tesla Charging Station; More! · Pocket (opens in new window) · Flipboard (opens in...
Durable '80s rockers Tesla ready to energize fans at park | Arkansas Democrat Gazette,03 Jul 2014,"Admission (including lawn seating): $54.99 the day of the concert, $49.99 online, $33.99 for children shorter than 48 inches and adults 55 and older, free for..."
Tesla Motors on a mission to hire American veterans,03 Jul 2014,"“HR was phenomenal with my deployment,” said Jason Deming, a 35-year-old vehicle test technician who is also a member of the Air National Guard and was deployed..."
Austin artists pay tribute to inventor Nikola Tesla at daylong event,03 Jul 2014,Austin artists pay tribute to inventor Nikola Tesla at daylong event ... Cathy Savage's “War of the Currents: Tesla and Edison Finger Puppets.” (.
"Unplugged Performance sweetens the look of your Tesla Model S for around $6,000",23 Jul 2014,"Unplugged Performance offers upgrade kits for you Tesla Model S, including entirely new fascia and side skirt kits."
Supercharger open and ready for business – for Tesla owners,23 Jul 2014,"Local residents and visitors alike may have noticed a new addition to Tifton, located behind Starbucks, near I-75 – a Tesla Supercharger station."
"Edmonds completes Tesla Model S ""Reverse Cannonball Run"", breaks record with 67 hour time, averaging 63mph",23 Jul 2014,"Edmonds completes Tesla Model S “Reverse Cannonball Run”, breaks record with 67 hour time, averaging 63mph ... Edmunds documented their unofficial record-breaking..."
Tesla is becoming the 800-pound green jobs gorilla,13 Aug 2014,"As states vie for the automaker's new battery factory, it is being showered with tax breaks -- and California is even considering waiving environmental..."
How to Build a Tesla Supercharger Station,13 Aug 2014,Time-lapse video showing construction of a 130 kW Tesla Supercharger station.
Tesla Gets Personal on its New Album 'Simplicity',13 Aug 2014,"Early on, Tesla would learn to stick with their beliefs. They had a song called “Love Song” that wasn't exactly the definition of “radio-friendly,” but it..."
"Tesla Roadster To Get Replacement Battery, 400-Mile Range: Musk",14 Aug 2014,"Retrofitting new powertrains to used cars isn't something that automakers have done, historically--but electric cars may change that rule. Now, Tesla Motors..."
Eva Longoria Stops at Gas Station With Her Tesla Model S: Not For Fuel,14 Aug 2014,Eva Longoria Stops at Gas Station With Her Tesla Model S: Not For Fuel.
Tesla Roadster getting 400-mile battery upgrade,14 Aug 2014,Tesla CEO Elon Musk says the Roadster will get a new battery upgrade by the end of 2014.
Jan ”Flash” Nilson completes first test at Karlskoga,20 Aug 2014,The double STCC champion completed a full day of testing at Karlskoga behind the wheel of Team Tidö's third Saab 9-3. ”It was clear that Jan enjoyed driving...
2015 Honda Accord holds price on exceptional standard features value,20 Aug 2014,"With less than a $200 price increase over 2014, Honda takes America's best selling car to new heights for 2015. Torque News takes a closer look."
The zodiac is the key to unlocking tech's greatest feuds,20 Aug 2014,"Thomas Edison was an Aquarius, born in the Week of Acceptance; Nikola Tesla was a Cancer, born in the Week of the Unconventional — no wonder the two..."
"Saleen's Tesla Model S–based FourSixteen EV Makes Sounds—Good, High-Pitched, Jet-Like Ones [w/ Video!]",11 Sep 2014,"Recently, Saleen Automotive announced it is juicing Tesla's Model S EV to create the FourSixteen sport sedan. Although Saleen's charged-up Tesla doesn't get a..."
Tesla iOS & Android app updated ahead of car's 6.0 firmware,11 Sep 2014,Tesla iOS & Android app updated ahead of car's 6.0 firmware ... Good news and bad news for Tesla Model S owners: the iOS and Android apps have been updated to...
MACAU DAILY TIMES 澳門每日時報Nevada bets USD1.3b on Tesla to push economy beyond gaming,11 Sep 2014,"Nevada casinos, the state's largest industry, took in USD11.2 billion in the year that ended in July. Now lawmakers must decide whether to wager as much as..."
Interview with Brian Wheat (Bass) (Tesla)Interview with Brian Wheat (Bass) (Tesla) - Your Online Magazine for Hard ...,07 Nov 2014,"Your Online Magazine for Hard Rock and Heavy Metal – reviews of the latest albums, live performances, and music festivals and much more!!!"
Bay Area's Coal Mining History at the Black Diamond Mines Regional Preserve,07 Nov 2014,"One-third of the world's energy use relies on the greenhouse gas-producing coal, and the United Nations released a sobering report last week about its..."
"AFM 2014 Promo Posters for IRON SKY 2, LAVALANTULA, and More",07 Nov 2014,"With the 2014 American Film Market underway, new promo posters have been released for Iron Sky 2, Lavalantula, Everything Carries Me to You, and Tomorrow."
Analyst sees beginning of the end for oil,28 Nov 2014,"""OPEC, like Rockefeller, ultimately damned itself,"" writes Wolfe Research's Paul Sankey."
Toyota Owner Loves Van Halen so Much He Painted the Car Like the Guitar,28 Nov 2014,A Van Halen fan decided to refresh his newly bought Toyota truck through an unique paint job. He covered his car in the same scheme of Eddie's guitar for...
Dr. Teak expands from California to South Florida,28 Nov 2014,"Dr. Teak, a California company that refinishes high-end outdoor furniture, has expanded into South Florida. The 10-year-old business opened its first East..."
"See Tesla Motors' sleek new Lyndhurst service center, showroom (photo gallery)",04 Dec 2014,Tesla Motors opened its first dual showroom and service center in Ohio in Lyndhurst recently. Check out photos of the facility and the Model S electric car.
Commentary: Let's make Texas friendly for auto consumers,04 Dec 2014,"Since introducing its revolutionary electric cars several years ago, Tesla Motors has been fighting for the right to sell its cars directly to consumers."
Revozport ready for Tesla Model S with R-Zentric line of mods [w/video],04 Dec 2014,Revozport offers carbon customization kits for souped-up Tesla Model S sedans.
That Whole BMW-Tesla Technology Partnership Talk Was Vaporware,05 Dec 2014,"Late last month, a few hints were dropped by none other than Tesla CEO Elon Musk regarding the possibility of a technical partnership with BMW."
Tesla Model S leads the pack in customer satisfaction. Again.,05 Dec 2014,"Of the 280 models included in the survey, the average satisfaction rate was above 70 percent, and only four vehicles had less than 50 percent of owners say they..."
"Fuel Cells A Long Way From Mainstream, Despite Toyota Launch",05 Dec 2014,"You would think that when an automotive giant like Toyota declared its fuel cell car ready for prime time, questions about hydrogen technology had been laid..."
Tesla Gigafactory For Electric-Car Batteries: Site Work Continues (Photos),07 Jan 2015,"Last September, Nevada governor Brian Sandoval signed a bill granting various tax breaks and incentives to Tesla Motors for construction of its massive..."
Winter Quirks with Tesla’s Cruise Control System,07 Jan 2015,"Tesla Model S cruise control ineffective when regenerative braking is limited due to cold weather conditions. In the image above, I had cruise control set at..."
Los Gatos: Is Tesla coming to town?,07 Jan 2015,"The proposed project at 201-225 Los Gatos-Saratoga Road includes the property now occupied by the PostalMate store, a liquor store, the former SV Home real..."
Auto Mafia: State Bans On Tesla Sales Expose Monopolistic Nature Of Franchise Laws,21 Jan 2015,"Once seen as the wheels of choice for the environmentally conscious or the socially pretentious, Tesla Motors is shifting in major ways the conversation..."
"Low gas prices, incentives change math for electric cars",21 Jan 2015,Drivers trying to calculate whether it's practical to own an electric car are facing a new math.
Tesla Model S Charging Costs in Australia,21 Jan 2015,More than 2 years after the it first went on sale in the US the Model S arrived in Australia in late December 2014. As an early owner of the Model S the car...
"Tesla's Firmware 6.2 Increases Model S P85D Top Speed, Lowers 0-60 MPH Sprint Time",14 Apr 2015,"Besides slaying range anxiety, Tesla Motors Firmware 6.2 update comes with two Easter eggs, but only for those who own a Model S P85D."
Tesla plans to pay $25 an hour at Gigafactory,14 Apr 2015,"Tesla Motors plans to pay an average hourly wage of $25 at its huge battery factory under construction near Reno, Nev., the head of the Economic Development..."
Record-breaking Tesla coil lights up Differdange,14 Apr 2015,"A Tesla coil in Differdange is thought by scientists to be a record-breaking piece of machinery, generating voltages above 1.7MV, more than the Guinness..."
Tesla Model S Gets A New Tuned Look From Larte Design,16 Apr 2015,German tuners Larte Design unveiled their new Enigma styling kit for the Tesla Model S at the 2015 TOP Marques show in Monaco today. Available soon for.
"Funny SpaceX Parody Features Tesla Model S, Dancing Elon Musk",16 Apr 2015,"Funny SpaceX Parody Features Tesla Model S, Dancing Elon Musk ... We have to admit, from PayPal to Tesla and SpaceX, Elon Musk has a pretty effervescent life."
Tesla Motors opens charging station at Mobile's Bel Air Mall - al.com,16 Apr 2015,"Tesla Motors, the California-based electric car maker, plans to open one of its free charging stations in Mobile this week. Installing the machine is a part..."
Musk needed a Tesla saviour and his search led to Google,28 Apr 2015,"ON MAY 8 2013, Tesla Motors shocked just about everyone by posting its first quarterly profit, reporting higher-than-expected demand for its Model S..."
Cedric The Entertainer tells Conan about taking Stevie Wonder for a Tesla ride,28 Apr 2015,"What happens when you combine a comedian, a blind, piano-playing singer and a Tesla Model S? Well, watch this clip from Conan to find out."
2014 fuel price turbulence didn’t pull the plug on EVs,28 Apr 2015,"April 28, 2015 | By: Zifei Yang and Uwe Tietge. Among the biggest stories of 2014 was the crash in global oil prices. Just when it looked like the world had..."
Interview: Finn Peacock talks solar battery storage in Australia (and more),07 Jul 2015,It's been a big year for news on solar battery storage in Australia with the release of Tesla's Powerwall onto the market. Finn Peacock talks this and more.
Elon Musk Offers Ten Million Dollars to Keep AI Under Control,07 Jul 2015,"Elon Musk, the mastermind behind Tesla Motors, SpaceX and Hyperloop, will offer $10 million in grants to fund 37 research projects dedicated to keeping."
Volkswagen Promises Battery Breakthrough for Electric Cars (And a Weird Little Scooter),07 Jul 2015,"The next generation e-Golf won't outrange a Tesla Model S, but it may be so cheap that it won't matter."
Fully Charged Host Robert Llewellyn Buys a Tesla Model S,08 Jul 2015,"Fully Charged is an interesting show about Electric Vehicles on YouTube. The host, Robert Llewellyn, recently bought a Tesla Model S."
"Tesla, CarMax, and Harley Davidson Under Analysts' Watch",08 Jul 2015,"In Wednesday's Analysts' Actions, TheStreet highlights an upbeat note on CarMax (KMX) along with a couple of downgrades on Harley-Davidson (HOG) and Tesla..."
Elon Musk believes the Model X will double Tesla's sales,08 Jul 2015,Tesla CEO Elon Musk believes its upcoming Model X crossover will be able to double the...
Who Is Elon Musk Competing With?,10 Jul 2015,Who is Elon Musk competing with? This question was originally answered on Quora by Jonathan Weinberg.
Tesla Motors to offer test drive experience through wine country,10 Jul 2015,"Alta Colina is teaming-up with Tesla Motors for a unique driving experience on Saturday, July 18. From 10 a.m. to 4 p.m. guests who have pre-registered will..."
IBM SoftLayer Cloud Adds Supercomputing Power with NVIDIA Tesla K80 Accelerators,10 Jul 2015,IBM SoftLayer Cloud Adds Supercomputing Power with NVIDIA Tesla K80 Accelerators ... IBM began offering NVIDIA Tesla K80 dual-GPU accelerators on SoftLayer cloud...
"Texas isn’t open for Tesla’s direct auto sales, Abbott says",16 Jul 2015,Tesla has been working to roll back state laws across the U.S. to allow the company to sell its $100000 vehicle without a traditional dealership.
One in three new cars sold in Norway is an electric vehicle,16 Jul 2015,"Meanwhile, the US registered the greatest number of EVs in Q1 2015—almost 15000."
Tesla Gigafactory could be biggest building in the world,16 Jul 2015,Massive expansion plans for the Gigafactory that Tesla is still building in the Nevada desert could make it the largest building in the world by any metric.
2018 Audi Q6: C-BEV Concept previews Audi's Tesla Model X rival,30 Jul 2015,The Audi C-BEV Concept will debut at the 2015 Frankfurt Motor Show previewing an electric Audi Q6 with which Audi will take the fight to the Tesla Model X.
Is There Really a $1000 Discount on the Tesla Model S?,30 Jul 2015,Tesla is making waves with an unusual viral marketing campaign offering $1000 referral discounts on the Model S. The offers are an effort to generate.
How to be as successful as Elon Musk,30 Jul 2015,"Justine Musk, the first wife of billionaire Elon Musk, knows a lot about extreme success — her ex-husband is a founder of PayPal and the CEO of Tesla and..."
Battersea Power Station's chimneys may be turned into giant Tesla coils,03 Aug 2015,The largest Tesla coils in the world so far are about 100ft tall – these would be 300ft. They would be partly powered by visitors walking on a piezoelectric...
Tesla chooses Solera for collision software services,03 Aug 2015,Tesla chooses Solera for collision software services ... Solera's collision estimating and customer communication platforms are now the sole choice of Tesla...
Lionel Richie's Black on Black Tesla Model S by T Sportline,03 Aug 2015,"T Sportline is the world's first electric car accessory tuner, specifically focusing on the Tesla cars. The company is run by a group of automobile."
2016 Tesla Model S dual-motor range launches in Australia: P85D with 'Ludicrous Mode' headline,11 Aug 2015,"Starting from $157,000, the flagship four-wheel-drive variant splits the dual-motor's power, with 375kW going to the rear wheels and 192kW to the fronts. While..."
Mark Twain and his eccentric scientist friend,11 Aug 2015,"Clockwise from top left: Milutin Tesla was a mathematics professor and orthodox priest in Croatia. His son, Nikola Tesla, in Croatia."
One lucky Tesla owner is getting 10 grand and a very special free Model X,11 Aug 2015,"Bjorn Nyland, a Tesla Model S owner and YouTube personality from Norway, tweeted at Musk notifying him of the 10 referrals. Musk replied in a subsequent..."
Luxury carmaker Fisker revved up for revival,12 Aug 2015,Fisker Automotive is back in business. The luxury car company will establish Southern California's first new car manufacturing plant in more than two...
"With New E-Bikes, 112-Year-Old Ford Is Thinking Like A Startup",12 Aug 2015,The auto industry is changing quickly and Ford is taking a page out of Elon Musk's book and thinking like a startup so they can keep up.
"2016 Scion FR-S, Tesla In Virginia, Hyundai Vision G Concept: What’s New @ The Car",12 Aug 2015,"From The Car Connection: 2016 Scion FR-S Review The Scion FR-S has a nimble and fun to drive spirit, with just enough of the modern conveniences,..."
"Tesla Online Shop Opens for Japan, You Can Buy Anything from T-Shirts to Chargers",14 Aug 2015,"Tesla has a new online shop but this time, their merchandising efforts are directed to the Asian market, namely the Japanese one."
Tesla sets stock offering price at $242 per share,14 Aug 2015,Shares of Tesla are up $1.99 to $244.50 in premarket trading. Related for Subscribers. Analysts:...
Has Larte Design Made The Tesla Model S Look Like A True Supercar?,14 Aug 2015,The Tesla Model S has been a raving success. Everyone wants to try it out and experience what supercar-like acceleration feels like in an EV.
[Video] Deep Blue Model X Seen with Transport Plastic Wrap,18 Aug 2015,Video of latest Tesla Model X sighting shows never-before-seen deep blue color and protective plastic transportation wrap.
How Elon Musk (probably) spends his vacations,18 Aug 2015,"When your day job involves trying to send 1,000,000 people to Mars, even your downtime activities skew ludicrous. SpaceX and Tesla CEO Elon Musk knows how..."
Aston Martin to take on Tesla with electric supersedan,18 Aug 2015,"High tech Tesla will soon be facing competition from an unlikely source. Aston Martin, founded in 1913 and still specializing in handcrafted machines..."
"Driver blows past Tesla's mileage rating, cruising 452 miles on one charge",26 Aug 2015,"Bjørn Nyland nearly doubled the expected mileage for a Tesla Model S. Mr. Nyland used ""hypermiling"" techniques, such as driving at slow speeds and coasting..."
2015 Tesla Model S P85D Review - Drive,26 Aug 2015,"Tesla claims the Model S P85D can run up to 491km on a fill, but buyers can increase that range by six per cent (to about 520km) by opting for the P90D model."
You Can Now Buy a Pre-Owned Model S at Tesla's First Dedicated Facility,26 Aug 2015,"There are many ways you can buy a new Tesla Model S, but when it comes to the pre-owned EVs things are not that easy. That is about to change though."
Chevy Silverado Burnout Winner with a Mistake,09 Sep 2015,This is an amazing Chevy Silverado Burnout. It's like supercharged. Dylan Stapelton won this burnout competition in April of 2015 in Virginia.
Elon Musk's Net Worth Is More Than The GDP Of Nicaragua — & 54 Other Countries,09 Sep 2015,"Tesla Motors and SpaceX CEO Elon Musk is a 44-year-old, South-African-born Silicon Valley star who also co-founded Zip2 and PayPal, and is known for..."
Mansory Tesla Model S is Surprisingly Subtle,09 Sep 2015,Mansory has unveiled its version of the Tesla Model S and it's surprisingly not as extreme as previous Mansory products. See the Mansory Tesla Model S here.
Companies Elon Musk has invested in,22 Sep 2015,"Elon Musk is worth $13.1 billion as of September 2015, but allegedly doesn't believe in the word ""business."" Advertisement. The tech entrepreneur, born in..."
Renovo's coupe recently seen going through testings at the Mazda Raceway,22 Sep 2015,"It has been a while since we've heard of Renovo Motors, the all-electric supercar maker backed by the deep-pocket VC firm True Ventures, but we hear that..."
"Apple Electric Car Is ""Committed Project,"" To Ship In 2019: Report",22 Sep 2015,Apple is reportedly speeding up its electric-car project.
"Renault Zoe sales are up 132% in France, giving more weight to the battery pack leasing model",24 Sep 2015,"Renault's all-electric compact, the Zoe, is the best-selling EV in France and still growing. Based on registration data gathered in the past 2 years,..."
Gallery: Tesla's P90D acceleration moves from 'Insane' to 'Ludicrous',24 Sep 2015,"At 65 mph on a 70-degree day, the P85D with 19-inch wheels can travel up to 285 miles on a single charge. The mileage sinks to 271 with 21-inch wheels."
Top Tesla Twitter Accounts You Should Follow to Get Early Warning on Stock Movements,24 Sep 2015,Want to know who are some of the best financial Tweeters trading Tesla (TSLA)?
Porsche Mission E: All-electric sports car to go on sale by 2020,08 Dec 2015,Mission E concept will become an all-electric sports car ready for mass production by end of decade.
Careers at Tesla: The Ups and Downs of Making 'Sexy Zero-Emission Cars',08 Dec 2015,"Working at Tesla Motors, the electronic car company started by Elon Musk — a science icon who's been compared to Iron Man on more than one occasion — isn't..."
"Tesla Adding 1,656 Employees Worldwide",08 Dec 2015,"As of Monday, December 7, there are 1,656 job openings listed on the Tesla website. Some are for radar engineers, a manager for Tesla's newest service..."
Watch the World's First Mind-Controlled Car in Action,09 Dec 2015,"When automobiles giant like Nissan, Toyota and Tesla are focusing on self-driving smart cars, Chinese researchers have taken the future of automotive car..."
Tesla launches in Mexico and hires former Google communication manager to lead marketing in country,09 Dec 2015,Blanco recently updated his LinkedIn profile to “Communications and Marketing Manager” at Tesla in Mexico. He was “Brand & Communications Senior Manager” for...
Car Safety Tests Are in For a Major Upgrade,09 Dec 2015,Auto regulators are advocating for crash and pedestrian avoidance features and new tests in an overhaul of the car safety rating system.
"Elon Musk: We should head to Mars, just in case World War 3 happens",15 Dec 2015,"Elon Musk is – it's fair to say – one of life's optimists. The glass is not only half full, but it's half full of delicious, refreshing apple juice, and."
Why Self-driving Cars Can't Work in Kenya Just Yet,15 Dec 2015,Very many times when driving you feel like letting go of the steering wheel and just sitting there and seeing how far it can go well without losing...
Tesla: The Early Years to Today—and Tomorrow,15 Dec 2015,"In 2003, engineers Martin Eberhard and Marc Tarpenning set up a new company, Tesla. The name is an intentional reference to Nikola Tesla (1856—1943),..."
Travel down Tesla's Tilburg assembly line with the Model S [Video],18 Dec 2015,Travel down Tesla's Tilburg assembly line with the Model S [Video] ... Tesla published a new video on its Youtube channel of a Model S traveling down the assembly...
"Tesla CEO Elon Musk joins call for CARB to force VW to invest in electric vehicles as ""punishment"" for 'DieselGate'",18 Dec 2015,The letter suggests that CARB releases VW from its obligation to fix diesel cars already on the road in California and instead accelerate its rollout of zero...
Tesla Model X Emergency Response Guide takes us deep into inner workings of the car with schematics,18 Dec 2015,"The guide provides instructions on how to safely handle the electric vehicle in an emergency situation and avoid high voltage components, which are a risk for..."
"Jay Leno is ""restomodding"" a 1914 Detroit Electric car [Video]",29 Dec 2015,Notorious gear-head Jay Leno has been a long-time supporter of electric vehicles and his latest restoration is a great reminder of the history of the...
